[
    {
        "class": "PESSOA",
        "entity": "MMaacch",
        "sentence": "MMaacchhaaddoo ddee AAssssiiss NEAD",
        "start_char": 37,
        "end_char": 44,
        "excerpt": "Universidade da Amazônia Viver ddee MMaacchhaaddoo ddee AAssssiiss NEAD",
        "gender": "male",
        "pch_occurrences": null,
        "dependencies": [
            {
                "head": "ddee",
                "child": "MMaacchhaaddoo",
                "dep_h": "nsubj",
                "pos_h": "NOUN",
                "lemma_h": "ddee",
                "dep_c": "amod",
                "pos_c": "PROPN",
                "lemma_c": "MMaacchhaaddoo",
                "categories": [],
                "pch_dependencies": []
            },
            {
                "head": "MMaacchhaaddoo",
                "child": "ddee",
                "dep_h": "amod",
                "pos_h": "PROPN",
                "lemma_h": "MMaacchhaaddoo",
                "dep_c": "nsubj",
                "pos_c": "NOUN",
                "lemma_c": "ddee",
                "categories": [],
                "pch_dependencies": []
            },
            {
                "head": "MMaacchhaaddoo",
                "child": "Viver",
                "dep_h": "amod",
                "pos_h": "PROPN",
                "lemma_h": "MMaacchhaaddoo",
                "dep_c": "ROOT",
                "pos_c": "PROPN",
                "lemma_c": "Viver",
                "categories": [],
                "pch_dependencies": []
            }
        ]
    },
    {
        "class": "PESSOA",
        "entity": "Ahasverus",
        "sentence": "Ahasverus, sentado em uma rocha, fita longamente o horizonte, onde passam duas águias cruzando-se.",
        "start_char": 251,
        "end_char": 260,
        "excerpt": "A DISTÂNCIA Av. Alcindo Cacela, 287  Umarizal CEP: 66060-902 Belém  Pará Fones: (91) 210-3196 / 210-3181  E-mail:  1  Viverde Machado de Assis Fim dos tempos. Ahasverus, sentado em uma rocha, fita longamente o horizonte, onde passam duas águias cruzando-se.",
        "gender": "male",
        "pch_occurrences": null,
        "dependencies": [
            {
                "head": "uma rocha",
                "child": "Ahasverus",
                "dep_h": "obl",
                "pos_h": "NOUN",
                "lemma_h": "rocha",
                "dep_c": "ROOT",
                "pos_c": "PROPN",
                "lemma_c": "Ahasverus",
                "categories": [],
                "pch_dependencies": []
            },
            {
                "head": ", fita",
                "child": "Ahasverus",
                "dep_h": "appos",
                "pos_h": "NOUN",
                "lemma_h": "fita",
                "dep_c": "ROOT",
                "pos_c": "PROPN",
                "lemma_c": "Ahasverus",
                "categories": [],
                "pch_dependencies": []
            },
            {
                "head": "o horizonte",
                "child": "Ahasverus",
                "dep_h": "nsubj",
                "pos_h": "NOUN",
                "lemma_h": "horizonte",
                "dep_c": "ROOT",
                "pos_c": "PROPN",
                "lemma_c": "Ahasverus",
                "categories": [],
                "pch_dependencies": []
            },
            {
                "head": "duas águias",
                "child": "Ahasverus",
                "dep_h": "obj",
                "pos_h": "NOUN",
                "lemma_h": "águia",
                "dep_c": "ROOT",
                "pos_c": "PROPN",
                "lemma_c": "Ahasverus",
                "categories": [],
                "pch_dependencies": []
            }
        ]
    },
    {
        "class": "PESSOA",
        "entity": "asverus",
        "sentence": "Ahasverus.",
        "start_char": 396,
        "end_char": 403,
        "excerpt": "Medita, depois sonha. Vai declinando o dia. Ahasverus.",
        "gender": "male",
        "pch_occurrences": null,
        "dependencies": []
    },
    {
        "class": "PESSOA",
        "entity": "Velha natureza",
        "sentence": "Velha natureza, adeus!",
        "start_char": 689,
        "end_char": 703,
        "excerpt": "Deliciosa idéia! Séculos de séculos vivi, cansado, mortificado, andando sempre, mas ei-los que acabam e vou morrer com eles. Velha natureza, adeus!",
        "gender": "unknown",
        "pch_occurrences": null,
        "dependencies": []
    },
    {
        "class": "PESSOA",
        "entity": "O errante",
        "sentence": "O errante não errará mais.",
        "start_char": 838,
        "end_char": 847,
        "excerpt": "Velha natureza, adeus! Céu azul, imenso céu for aberto para que desçam os espíritos da vida nova, terra inimiga, que me não comeste os ossos, adeus! O errante não errará mais.",
        "gender": "male",
        "pch_occurrences": {
            "osso": {
                "syns": [
                    "ossos"
                ],
                "occurrences": [
                    "osso",
                    "ossos"
                ],
                "occurrences_n": 2
            }
        },
        "dependencies": [
            {
                "head": "errará",
                "child": "O errante",
                "dep_h": "ROOT",
                "pos_h": "VERB",
                "lemma_h": "errar",
                "dep_c": "nsubj",
                "pos_c": "NOUN",
                "lemma_c": "errante",
                "categories": [
                    "social"
                ],
                "pch_dependencies": []
            }
        ]
    },
    {
        "class": "PESSOA",
        "entity": "Deus",
        "sentence": "Deus me perdoará, se quiser, mas a morte consola-me.",
        "start_char": 865,
        "end_char": 869,
        "excerpt": "Céu azul, imenso céu for aberto para que desçam os espíritos da vida nova, terra inimiga, que me não comeste os ossos, adeus! O errante não errará mais. Deus me perdoará, se quiser, mas a morte consola-me.",
        "gender": "male",
        "pch_occurrences": {
            "osso": {
                "syns": [
                    "ossos"
                ],
                "occurrences": [
                    "osso",
                    "ossos"
                ],
                "occurrences_n": 2
            }
        },
        "dependencies": [
            {
                "head": "perdoará",
                "child": "Deus",
                "dep_h": "ROOT",
                "pos_h": "VERB",
                "lemma_h": "perdoar",
                "dep_c": "nsubj",
                "pos_c": "PROPN",
                "lemma_c": "Deus",
                "categories": [],
                "pch_dependencies": []
            }
        ]
    },
    {
        "class": "PESSOA",
        "entity": "águias",
        "sentence": "Aquela montanha é áspera como a minha dor; aquelas águias, que ali passam, devem ser famintas como o meu desespero.",
        "start_char": 969,
        "end_char": 975,
        "excerpt": "O errante não errará mais. Deus me perdoará, se quiser, mas a morte consola-me. Aquela montanha é áspera como a minha dor; aquelas águias, que ali passam, devem ser famintas como o meu desespero.",
        "gender": "female",
        "pch_occurrences": null,
        "dependencies": [
            {
                "head": "a minha dor",
                "child": "; aquelas águias",
                "dep_h": "obl",
                "pos_h": "NOUN",
                "lemma_h": "dor",
                "dep_c": "appos",
                "pos_c": "NOUN",
                "lemma_c": "águia",
                "categories": [],
                "pch_dependencies": []
            },
            {
                "head": "; aquelas águias",
                "child": "a minha dor",
                "dep_h": "appos",
                "pos_h": "NOUN",
                "lemma_h": "águia",
                "dep_c": "obl",
                "pos_c": "NOUN",
                "lemma_c": "dor",
                "categories": [],
                "pch_dependencies": []
            },
            {
                "head": "; aquelas águias",
                "child": "áspera",
                "dep_h": "appos",
                "pos_h": "NOUN",
                "lemma_h": "águia",
                "dep_c": "ROOT",
                "pos_c": "NOUN",
                "lemma_c": "áspera",
                "categories": [],
                "pch_dependencies": []
            }
        ]
    },
    {
        "class": "PESSOA",
        "entity": "águia",
        "sentence": "Morrereis também, águias divinas?",
        "start_char": 1052,
        "end_char": 1057,
        "excerpt": "Deus me perdoará, se quiser, mas a morte consola-me. Aquela montanha é áspera como a minha dor; aquelas águias, que ali passam, devem ser famintas como o meu desespero. Morrereis também, águias divinas?",
        "gender": "female",
        "pch_occurrences": null,
        "dependencies": [
            {
                "head": "a minha dor",
                "child": "; aquelas águias",
                "dep_h": "obl",
                "pos_h": "NOUN",
                "lemma_h": "dor",
                "dep_c": "appos",
                "pos_c": "NOUN",
                "lemma_c": "águia",
                "categories": [],
                "pch_dependencies": []
            },
            {
                "head": "; aquelas águias",
                "child": "a minha dor",
                "dep_h": "appos",
                "pos_h": "NOUN",
                "lemma_h": "águia",
                "dep_c": "obl",
                "pos_c": "NOUN",
                "lemma_c": "dor",
                "categories": [],
                "pch_dependencies": []
            },
            {
                "head": "; aquelas águias",
                "child": "áspera",
                "dep_h": "appos",
                "pos_h": "NOUN",
                "lemma_h": "águia",
                "dep_c": "ROOT",
                "pos_c": "NOUN",
                "lemma_c": "áspera",
                "categories": [],
                "pch_dependencies": []
            },
            {
                "head": "Morrereis",
                "child": ", águias",
                "dep_h": "ROOT",
                "pos_h": "PROPN",
                "lemma_h": "Morrereis",
                "dep_c": "conj",
                "pos_c": "NOUN",
                "lemma_c": "águia",
                "categories": [],
                "pch_dependencies": []
            },
            {
                "head": ", águias",
                "child": "divinas",
                "dep_h": "conj",
                "pos_h": "NOUN",
                "lemma_h": "águia",
                "dep_c": "amod",
                "pos_c": "ADJ",
                "lemma_c": "divino",
                "categories": [
                    "aparencia_carater_social"
                ],
                "pch_dependencies": []
            },
            {
                "head": ", águias",
                "child": "Morrereis",
                "dep_h": "conj",
                "pos_h": "NOUN",
                "lemma_h": "águia",
                "dep_c": "ROOT",
                "pos_c": "PROPN",
                "lemma_c": "Morrereis",
                "categories": [],
                "pch_dependencies": []
            }
        ]
    },
    {
        "class": "PESSOA",
        "entity": "s divinas",
        "sentence": "Morrereis também, águias divinas?",
        "start_char": 1057,
        "end_char": 1066,
        "excerpt": "Deus me perdoará, se quiser, mas a morte consola-me. Aquela montanha é áspera como a minha dor; aquelas águias, que ali passam, devem ser famintas como o meu desespero. Morrereis também, águias divinas?",
        "gender": "unknown",
        "pch_occurrences": null,
        "dependencies": []
    },
    {
        "class": "PESSOA",
        "entity": "os homens",
        "sentence": "Certo que os homens acabaram; a terra está nua deles.",
        "start_char": 1088,
        "end_char": 1097,
        "excerpt": "Morrereis também, águias divinas? Prometeu. Certo que os homens acabaram; a terra está nua deles.",
        "gender": "male",
        "pch_occurrences": null,
        "dependencies": [
            {
                "head": "acabaram",
                "child": "os homens",
                "dep_h": "acl:relcl",
                "pos_h": "VERB",
                "lemma_h": "acabar",
                "dep_c": "nsubj",
                "pos_c": "NOUN",
                "lemma_c": "homem",
                "categories": [
                    "aparencia",
                    "outro"
                ],
                "pch_dependencies": []
            },
            {
                "head": "os homens",
                "child": "Certo",
                "dep_h": "nsubj",
                "pos_h": "NOUN",
                "lemma_h": "homem",
                "dep_c": "ROOT",
                "pos_c": "ADJ",
                "lemma_c": "certo",
                "categories": [
                    "outro"
                ],
                "pch_dependencies": []
            }
        ]
    },
    {
        "class": "PESSOA",
        "entity": "asverus",
        "sentence": "Ahasverus.",
        "start_char": 396,
        "end_char": 403,
        "excerpt": "Medita, depois sonha. Vai declinando o dia. Ahasverus.",
        "gender": "male",
        "pch_occurrences": null,
        "dependencies": []
    },
    {
        "class": "PESSOA",
        "entity": "o último",
        "sentence": "Céus implacáveis, não sou então o último?",
        "start_char": 1211,
        "end_char": 1219,
        "excerpt": "Ouço ainda uma voz... Voz de homem? Céus implacáveis, não sou então o último?",
        "gender": "unknown",
        "pch_occurrences": null,
        "dependencies": []
    },
    {
        "class": "PESSOA",
        "entity": "arcanjos de Israel",
        "sentence": "Há em teus grandes olhos alguma cousa parecida com a luz misteriosa dos arcanjos de Israel; não és homem...",
        "start_char": 1330,
        "end_char": 1348,
        "excerpt": "Ei-lo que se aproxima... Quem és tu? Há em teus grandes olhos alguma cousa parecida com a luz misteriosa dos arcanjos de Israel; não és homem...",
        "gender": "unknown",
        "pch_occurrences": {
            "olho": {
                "syns": [
                    "olhos"
                ],
                "occurrences": [
                    "olhos",
                    "olho"
                ],
                "occurrences_n": 2
            }
        },
        "dependencies": []
    },
    {
        "class": "PESSOA",
        "entity": "asverus",
        "sentence": "Ahasverus.",
        "start_char": 396,
        "end_char": 403,
        "excerpt": "Medita, depois sonha. Vai declinando o dia. Ahasverus.",
        "gender": "male",
        "pch_occurrences": null,
        "dependencies": []
    },
    {
        "class": "PESSOA",
        "entity": "asverus",
        "sentence": "Ahasverus.",
        "start_char": 396,
        "end_char": 403,
        "excerpt": "Medita, depois sonha. Vai declinando o dia. Ahasverus.",
        "gender": "male",
        "pch_occurrences": null,
        "dependencies": []
    },
    {
        "class": "PESSOA",
        "entity": "Ahasver",
        "sentence": "O mal acabará; os ventos não espalharão mais nem os germes da morte, nem o clamor dos oprimidos, mas tão somente a cantiga do amor perene e a bênção da universal justiça... Ahasverus.",
        "start_char": 2087,
        "end_char": 2094,
        "excerpt": "Sim, homem derradeiro, toda a plebe dos espíritos perecerá para sempre; a flor deles é que voltará à terra para reger as coisas. Os tempos serão retificados. O mal acabará; os ventos não espalharão mais nem os germes da morte, nem o clamor dos oprimidos, mas tão somente a cantiga do amor perene e a bênção da universal justiça... Ahasverus.",
        "gender": "male",
        "pch_occurrences": null,
        "dependencies": []
    },
    {
        "class": "PESSOA",
        "entity": "Sidônia",
        "sentence": "Crê-me, tu que és imortal, para os ossos que apodrecem na terra as púrpuras de Sidônia não valem nada.",
        "start_char": 2248,
        "end_char": 2255,
        "excerpt": "O mal acabará; os ventos não espalharão mais nem os germes da morte, nem o clamor dos oprimidos, mas tão somente a cantiga do amor perene e a bênção da universal justiça... Ahasverus. Que importa à espécie que vai morrer comigo toda essa delícia póstuma? Crê-me, tu que és imortal, para os ossos que apodrecem na terra as púrpuras de Sidônia não valem nada.",
        "gender": "female",
        "pch_occurrences": {
            "osso": {
                "syns": [
                    "ossos"
                ],
                "occurrences": [
                    "osso",
                    "ossos"
                ],
                "occurrences_n": 2
            }
        },
        "dependencies": [
            {
                "head": "as púrpuras",
                "child": "Sidônia",
                "dep_h": "nsubj",
                "pos_h": "NOUN",
                "lemma_h": "púrpura",
                "dep_c": "nmod",
                "pos_c": "PROPN",
                "lemma_c": "Sidônia",
                "categories": [],
                "pch_dependencies": []
            },
            {
                "head": "Sidônia",
                "child": "as púrpuras",
                "dep_h": "nmod",
                "pos_h": "PROPN",
                "lemma_h": "Sidônia",
                "dep_c": "nsubj",
                "pos_c": "NOUN",
                "lemma_c": "púrpura",
                "categories": [],
                "pch_dependencies": []
            },
            {
                "head": "Sidônia",
                "child": "Crê-me",
                "dep_h": "nmod",
                "pos_h": "PROPN",
                "lemma_h": "Sidônia",
                "dep_c": "ROOT",
                "pos_c": "PROPN",
                "lemma_c": "Crê-me",
                "categories": [],
                "pch_dependencies": []
            }
        ]
    },
    {
        "class": "PESSOA",
        "entity": "O Senhor",
        "sentence": "O Senhor te ouça!",
        "start_char": 2426,
        "end_char": 2434,
        "excerpt": "O que tu me contas é ainda melhor que o sonho de Campanella. Na cidade deste havia delitos e enfermidades; a tua exclui todas as lesões morais e físicas. O Senhor te ouça!",
        "gender": "male",
        "pch_occurrences": null,
        "dependencies": [
            {
                "head": "ouça",
                "child": "O Senhor",
                "dep_h": "ROOT",
                "pos_h": "VERB",
                "lemma_h": "ouça",
                "dep_c": "nsubj",
                "pos_c": "PROPN",
                "lemma_c": "Senhor",
                "categories": [],
                "pch_dependencies": []
            }
        ]
    },
    {
        "class": "PESSOA",
        "entity": "asverus",
        "sentence": "Ahasverus.",
        "start_char": 396,
        "end_char": 403,
        "excerpt": "Medita, depois sonha. Vai declinando o dia. Ahasverus.",
        "gender": "male",
        "pch_occurrences": null,
        "dependencies": []
    },
    {
        "class": "PESSOA",
        "entity": "Milheiros",
        "sentence": "Milheiros de anos?",
        "start_char": 2944,
        "end_char": 2953,
        "excerpt": "Homens que apenas respiraram por dezenas deles, inventaram um sentimento de enfado, tedium vitae, que eles nunca puderam conhecer, ao menos em toda a sua implacável e vasta realidade, porque é preciso haver calcado, como eu, todas as gerações e todas as ruínas, para experimentar esse profundo fastio da existência. Prometeu. Milheiros de anos?",
        "gender": "male",
        "pch_occurrences": null,
        "dependencies": [
            {
                "head": "Milheiros",
                "child": "anos",
                "dep_h": "ROOT",
                "pos_h": "NOUN",
                "lemma_h": "milheiro",
                "dep_c": "nmod",
                "pos_c": "NOUN",
                "lemma_c": "ano",
                "categories": [],
                "pch_dependencies": []
            },
            {
                "head": "anos",
                "child": "Milheiros",
                "dep_h": "nmod",
                "pos_h": "NOUN",
                "lemma_h": "ano",
                "dep_c": "ROOT",
                "pos_c": "NOUN",
                "lemma_c": "milheiro",
                "categories": [],
                "pch_dependencies": []
            }
        ]
    },
    {
        "class": "PESSOA",
        "entity": "asverus",
        "sentence": "Ahasverus.",
        "start_char": 396,
        "end_char": 403,
        "excerpt": "Medita, depois sonha. Vai declinando o dia. Ahasverus.",
        "gender": "male",
        "pch_occurrences": null,
        "dependencies": []
    },
    {
        "class": "PESSOA",
        "entity": "Ahasverus",
        "sentence": "Meu nome é Ahasverus: vivia em Jerusalém, ao tempo em que iam crucificar Jesus Cristo.",
        "start_char": 2985,
        "end_char": 2994,
        "excerpt": "Milheiros de anos? Ahasverus. Meu nome é Ahasverus: vivia em Jerusalém, ao tempo em que iam crucificar Jesus Cristo.",
        "gender": "male",
        "pch_occurrences": null,
        "dependencies": [
            {
                "head": "Meu nome",
                "child": "Ahasverus",
                "dep_h": "nsubj",
                "pos_h": "NOUN",
                "lemma_h": "nome",
                "dep_c": "ROOT",
                "pos_c": "PROPN",
                "lemma_c": "Ahasverus",
                "categories": [],
                "pch_dependencies": []
            },
            {
                "head": "Ahasverus",
                "child": "Meu nome",
                "dep_h": "ROOT",
                "pos_h": "PROPN",
                "lemma_h": "Ahasverus",
                "dep_c": "nsubj",
                "pos_c": "NOUN",
                "lemma_c": "nome",
                "categories": [],
                "pch_dependencies": []
            },
            {
                "head": "Jerusalém",
                "child": "Ahasverus",
                "dep_h": "obl",
                "pos_h": "PROPN",
                "lemma_h": "Jerusalém",
                "dep_c": "ROOT",
                "pos_c": "PROPN",
                "lemma_c": "Ahasverus",
                "categories": [],
                "pch_dependencies": []
            },
            {
                "head": "tempo",
                "child": "Ahasverus",
                "dep_h": "obl",
                "pos_h": "NOUN",
                "lemma_h": "tempo",
                "dep_c": "ROOT",
                "pos_c": "PROPN",
                "lemma_c": "Ahasverus",
                "categories": [],
                "pch_dependencies": []
            },
            {
                "head": "Jesus Cristo",
                "child": "Ahasverus",
                "dep_h": "obj",
                "pos_h": "PROPN",
                "lemma_h": "Jesus",
                "dep_c": "ROOT",
                "pos_c": "PROPN",
                "lemma_c": "Ahasverus",
                "categories": [],
                "pch_dependencies": []
            }
        ]
    },
    {
        "class": "PESSOA",
        "entity": "Jesus Cristo",
        "sentence": "Meu nome é Ahasverus: vivia em Jerusalém, ao tempo em que iam crucificar Jesus Cristo.",
        "start_char": 3047,
        "end_char": 3059,
        "excerpt": "Milheiros de anos? Ahasverus. Meu nome é Ahasverus: vivia em Jerusalém, ao tempo em que iam crucificar Jesus Cristo.",
        "gender": "male",
        "pch_occurrences": null,
        "dependencies": [
            {
                "head": "crucificar",
                "child": "Jesus Cristo",
                "dep_h": "acl:relcl",
                "pos_h": "VERB",
                "lemma_h": "crucificar",
                "dep_c": "obj",
                "pos_c": "PROPN",
                "lemma_c": "Jesus",
                "categories": [],
                "pch_dependencies": []
            },
            {
                "head": "Jesus Cristo",
                "child": "tempo",
                "dep_h": "obj",
                "pos_h": "PROPN",
                "lemma_h": "Jesus",
                "dep_c": "obl",
                "pos_c": "NOUN",
                "lemma_c": "tempo",
                "categories": [],
                "pch_dependencies": []
            },
            {
                "head": "Jesus Cristo",
                "child": "Ahasverus",
                "dep_h": "obj",
                "pos_h": "PROPN",
                "lemma_h": "Jesus",
                "dep_c": "ROOT",
                "pos_c": "PROPN",
                "lemma_c": "Ahasverus",
                "categories": [],
                "pch_dependencies": []
            }
        ]
    },
    {
        "class": "PESSOA",
        "entity": "Os fariseus",
        "sentence": "Os fariseus diziam que o filho de Maria vinha destruir a lei, e que era preciso matá-lo; eu, pobre ignorante, quis realçar o meu zelo e daí a ação daquele dia.",
        "start_char": 3475,
        "end_char": 3486,
        "excerpt": "Tal é a minha culpa; não tive piedade para com aquele que ia morrer. Não sei mesmo como isto foi. Os fariseus diziam que o filho de Maria vinha destruir a lei, e que era preciso matá-lo; eu, pobre ignorante, quis realçar o meu zelo e daí a ação daquele dia.",
        "gender": "male",
        "pch_occurrences": null,
        "dependencies": [
            {
                "head": "diziam",
                "child": "Os fariseus",
                "dep_h": "ROOT",
                "pos_h": "VERB",
                "lemma_h": "dizer",
                "dep_c": "nsubj",
                "pos_c": "NOUN",
                "lemma_c": "fariseu",
                "categories": [],
                "pch_dependencies": []
            }
        ]
    },
    {
        "class": "PESSOA",
        "entity": "o filho de Maria",
        "sentence": "Os fariseus diziam que o filho de Maria vinha destruir a lei, e que era preciso matá-lo; eu, pobre ignorante, quis realçar o meu zelo e daí a ação daquele dia.",
        "start_char": 3498,
        "end_char": 3514,
        "excerpt": "Tal é a minha culpa; não tive piedade para com aquele que ia morrer. Não sei mesmo como isto foi. Os fariseus diziam que o filho de Maria vinha destruir a lei, e que era preciso matá-lo; eu, pobre ignorante, quis realçar o meu zelo e daí a ação daquele dia.",
        "gender": "unknown",
        "pch_occurrences": null,
        "dependencies": []
    },
    {
        "class": "PESSOA",
        "entity": "Os outros homens",
        "sentence": "Os outros homens leram da vida um capítulo, tu leste o livro inteiro.",
        "start_char": 3878,
        "end_char": 3894,
        "excerpt": "Prometeu. Certo que os homens acabaram; a terra está nua deles. Ahasverus. Ouço ainda uma voz... Voz de homem? Céus implacáveis, não sou então o último? Ei-lo que se aproxima... Quem és tu? Há em teus grandes olhos alguma cousa parecida com a luz misteriosa dos arcanjos de Israel; não és homem... Prometeu. Não. Ahasverus. Raça divina? Prometeu. Tu o disseste. Ahasverus. Não te conheço; mas que importa que te não conheça? Não és homem; posso então morrer; pois sou o último, e fecho a porta da vida. Prometeu. A vida, como a antiga Tebas, tem cem portas. Fechas uma, outras se abrirão. És o último da tua espécie? Virá outra espécie melhor, não feita do mesmo barro, mas da mesma luz. Sim, homem derradeiro, toda a plebe dos espíritos perecerá para sempre; a flor deles é que voltará à terra para reger as coisas. Os tempos serão retificados. O mal acabará; os ventos não espalharão mais nem os germes da morte, nem o clamor dos oprimidos, mas tão somente a cantiga do amor perene e a bênção da universal justiça... Ahasverus. Que importa à espécie que vai morrer comigo toda essa delícia póstuma? Crê-me, tu que és imortal, para os ossos que apodrecem na terra as púrpuras de Sidônia não valem nada. O que tu me contas é ainda melhor que o sonho de Campanella. Na cidade deste havia delitos e enfermidades; a tua exclui todas as lesões morais e físicas. O Senhor te ouça! Mas deixa-me ir morrer. Prometeu. Vai, vai. Que pressa tens em acabar os teus dias? Ahasverus. A pressa de um homem que tem vivido milheiros de anos. Sim, milheiros de anos. Homens que apenas respiraram por dezenas deles, inventaram um sentimento de enfado, tedium vitae, que eles nunca puderam conhecer, ao menos em toda a sua implacável e vasta realidade, porque é preciso haver calcado, como eu, todas as gerações e todas as ruínas, para experimentar esse profundo fastio da existência. Prometeu. Milheiros de anos? Ahasverus. Meu nome é Ahasverus: vivia em Jerusalém, ao tempo em que iam crucificar Jesus Cristo. Quando ele passou pela minha porta, afrouxou ao peso do madeiro que levava aos ombros, e eu empurrei-o, bradando-lhe que não parasse, 2  que não descansasse, que fosse andando até à colina, onde tinha de ser crucificado... Então uma voz anunciou-me do céu que eu andaria sempre, continuamente, até o fim dos tempos. Tal é a minha culpa; não tive piedade para com aquele que ia morrer. Não sei mesmo como isto foi. Os fariseus diziam que o filho de Maria vinha destruir a lei, e que era preciso matá-lo; eu, pobre ignorante, quis realçar o meu zelo e daí a ação daquele dia. Que de vezes vi isto mesmo, depois, atravessando os tempos e as cidades! Onde quer que o zelo penetrou numa alma subalterna, fez-se cruel ou ridículo. Foi a minha culpa irremissível. Prometeu. Grave culpa, em verdade, mas a pena foi benévola. Os outros homens leram da vida um capítulo, tu leste o livro inteiro.",
        "gender": "male",
        "pch_occurrences": {
            "olho": {
                "syns": [
                    "olhos"
                ],
                "occurrences": [
                    "olhos",
                    "olho"
                ],
                "occurrences_n": 2
            },
            "ombro": {
                "syns": [
                    "ombros"
                ],
                "occurrences": [
                    "ombros",
                    "ombro"
                ],
                "occurrences_n": 2
            },
            "osso": {
                "syns": [
                    "ossos"
                ],
                "occurrences": [
                    "osso",
                    "ossos"
                ],
                "occurrences_n": 2
            }
        },
        "dependencies": [
            {
                "head": "leram",
                "child": "Os outros homens",
                "dep_h": "ROOT",
                "pos_h": "VERB",
                "lemma_h": "ler",
                "dep_c": "nsubj",
                "pos_c": "NOUN",
                "lemma_c": "homem",
                "categories": [
                    "social",
                    "outro"
                ],
                "pch_dependencies": []
            }
        ]
    },
    {
        "class": "PESSOA",
        "entity": "and",
        "sentence": "À convulsão trágica precede a do riso, a vida brota da morte, cegonhas e andorinhas trocam de clima, sem jamais abandoná- lo inteiramente;",
        "start_char": 4166,
        "end_char": 4169,
        "excerpt": "Há páginas melancólicas? Há outras joviais e felizes. À convulsão trágica precede a do riso, a vida brota da morte, cegonhas e andorinhas trocam de clima, sem jamais abandoná- lo inteiramente;",
        "gender": "female",
        "pch_occurrences": null,
        "dependencies": [
            {
                "head": "morte",
                "child": "andorinhas",
                "dep_h": "nmod",
                "pos_h": "NOUN",
                "lemma_h": "morte",
                "dep_c": "conj",
                "pos_c": "NOUN",
                "lemma_c": "andorinha",
                "categories": [],
                "pch_dependencies": []
            },
            {
                "head": "andorinhas",
                "child": "morte",
                "dep_h": "conj",
                "pos_h": "NOUN",
                "lemma_h": "andorinha",
                "dep_c": "nmod",
                "pos_c": "NOUN",
                "lemma_c": "morte",
                "categories": [],
                "pch_dependencies": []
            },
            {
                "head": "andorinhas",
                "child": "a vida",
                "dep_h": "conj",
                "pos_h": "NOUN",
                "lemma_h": "andorinha",
                "dep_c": "nsubj",
                "pos_c": "NOUN",
                "lemma_c": "vida",
                "categories": [],
                "pch_dependencies": []
            },
            {
                "head": "abandoná-",
                "child": "inteiramente",
                "dep_h": "conj",
                "pos_h": "VERB",
                "lemma_h": "abandoná-",
                "dep_c": "obl",
                "pos_c": "NOUN",
                "lemma_c": "inteiramente",
                "categories": [],
                "pch_dependencies": []
            }
        ]
    },
    {
        "class": "PESSOA",
        "entity": "Sardanapalo",
        "sentence": "dança alternada da natureza, que dá a mão esquerda a Jó e a direita a Sardanapalo.",
        "start_char": 4519,
        "end_char": 4530,
        "excerpt": "é assim que tudo se concerta e restitui. Tu viste isso, não dez vezes, não mil vezes, mas todas as vezes; viste a magnificência da terra curando a aflição da alma, e a alegria da alma suprindo à desolação das cousas; dança alternada da natureza, que dá a mão esquerda a Jó e a direita a Sardanapalo.",
        "gender": "male",
        "pch_occurrences": {
            "mão": {
                "syns": [
                    "mãos"
                ],
                "occurrences": [
                    "mão"
                ],
                "occurrences_n": 1
            }
        },
        "dependencies": [
            {
                "head": "direita",
                "child": "Sardanapalo",
                "dep_h": "conj",
                "pos_h": "NOUN",
                "lemma_h": "direita",
                "dep_c": "nmod",
                "pos_c": "PROPN",
                "lemma_c": "Sardanapalo",
                "categories": [],
                "pch_dependencies": []
            },
            {
                "head": "Sardanapalo",
                "child": "direita",
                "dep_h": "nmod",
                "pos_h": "PROPN",
                "lemma_h": "Sardanapalo",
                "dep_c": "conj",
                "pos_c": "NOUN",
                "lemma_c": "direita",
                "categories": [],
                "pch_dependencies": []
            },
            {
                "head": "Sardanapalo",
                "child": "Jó",
                "dep_h": "nmod",
                "pos_h": "PROPN",
                "lemma_h": "Sardanapalo",
                "dep_c": "iobj",
                "pos_c": "PROPN",
                "lemma_c": "Jó",
                "categories": [],
                "pch_dependencies": []
            },
            {
                "head": "Sardanapalo",
                "child": "dança",
                "dep_h": "nmod",
                "pos_h": "PROPN",
                "lemma_h": "Sardanapalo",
                "dep_c": "ROOT",
                "pos_c": "NOUN",
                "lemma_c": "dança",
                "categories": [],
                "pch_dependencies": []
            }
        ]
    },
    {
        "class": "PESSOA",
        "entity": "asverus",
        "sentence": "Ahasverus.",
        "start_char": 396,
        "end_char": 403,
        "excerpt": "Medita, depois sonha. Vai declinando o dia. Ahasverus.",
        "gender": "male",
        "pch_occurrences": null,
        "dependencies": []
    },
    {
        "class": "PESSOA",
        "entity": "asverus",
        "sentence": "Ahasverus.",
        "start_char": 396,
        "end_char": 403,
        "excerpt": "Medita, depois sonha. Vai declinando o dia. Ahasverus.",
        "gender": "male",
        "pch_occurrences": null,
        "dependencies": []
    },
    {
        "class": "PESSOA",
        "entity": "povos bárbaros e cultos",
        "sentence": "Ia a toda parte, qualquer que fosse a raça, o culto ou a língua; sóis e neves, povos bárbaros e cultos, ilhas, continentes, onde quer que respirasse um homem aí respirei eu.",
        "start_char": 4860,
        "end_char": 4883,
        "excerpt": "Saí de Jerusalém. Comecei a peregrinação dos tempos. Ia a toda parte, qualquer que fosse a raça, o culto ou a língua; sóis e neves, povos bárbaros e cultos, ilhas, continentes, onde quer que respirasse um homem aí respirei eu.",
        "gender": "unknown",
        "pch_occurrences": {
            "língua": {
                "syns": [
                    "línguas"
                ],
                "occurrences": [
                    "língua"
                ],
                "occurrences_n": 1
            }
        },
        "dependencies": []
    },
    {
        "class": "PESSOA",
        "entity": "a última",
        "sentence": "Vede; cá está a última.",
        "start_char": 5079,
        "end_char": 5087,
        "excerpt": "Trabalho é refúgio, e não tive esse refúgio. Cada manhã achava comigo a moeda do dia... Vede; cá está a última.",
        "gender": "unknown",
        "pch_occurrences": null,
        "dependencies": []
    },
    {
        "class": "PESSOA",
        "entity": "os heróis",
        "sentence": "os heróis dissipavam-se em mitos, na penumbra, ao longe; e a história ia caindo aos pedaços, não lhe ficando mais que duas ou três feições vagas e remotas.",
        "start_char": 5495,
        "end_char": 5504,
        "excerpt": "As línguas que morriam ficavam com o meu nome embutido na ossada. Com o volver dos tempos, esquecia-se tudo; os heróis dissipavam-se em mitos, na penumbra, ao longe; e a história ia caindo aos pedaços, não lhe ficando mais que duas ou três feições vagas e remotas.",
        "gender": "male",
        "pch_occurrences": {
            "língua": {
                "syns": [
                    "línguas"
                ],
                "occurrences": [
                    "línguas",
                    "língua"
                ],
                "occurrences_n": 2
            }
        },
        "dependencies": [
            {
                "head": "dissipavam-se",
                "child": "os heróis",
                "dep_h": "parataxis",
                "pos_h": "VERB",
                "lemma_h": "dissipavar se",
                "dep_c": "nsubj",
                "pos_c": "NOUN",
                "lemma_c": "herói",
                "categories": [],
                "pch_dependencies": []
            }
        ]
    },
    {
        "class": "PESSOA",
        "entity": "asverus",
        "sentence": "Ahasverus.",
        "start_char": 396,
        "end_char": 403,
        "excerpt": "Medita, depois sonha. Vai declinando o dia. Ahasverus.",
        "gender": "male",
        "pch_occurrences": null,
        "dependencies": []
    },
    {
        "class": "PESSOA",
        "entity": "os outros homens",
        "sentence": "Sim, mas vi padecer os outros homens, e para o fim o espetáculo da alegria dava-me a mesma sensação que os discursos de um doido.",
        "start_char": 6192,
        "end_char": 6208,
        "excerpt": "Mas não padeceste, creio; é alguma cousa não padecer nada. Ahasverus. Sim, mas vi padecer os outros homens, e para o fim o espetáculo da alegria dava-me a mesma sensação que os discursos de um doido.",
        "gender": "male",
        "pch_occurrences": null,
        "dependencies": [
            {
                "head": "padecer",
                "child": "os outros homens",
                "dep_h": "xcomp",
                "pos_h": "VERB",
                "lemma_h": "padecer",
                "dep_c": "obj",
                "pos_c": "NOUN",
                "lemma_c": "homem",
                "categories": [
                    "outro"
                ],
                "pch_dependencies": []
            },
            {
                "head": "os outros homens",
                "child": ", e para o fim",
                "dep_h": "obj",
                "pos_h": "NOUN",
                "lemma_h": "homem",
                "dep_c": "conj",
                "pos_c": "NOUN",
                "lemma_c": "fim",
                "categories": [
                    "outro"
                ],
                "pch_dependencies": []
            },
            {
                "head": ", e para o fim",
                "child": "os outros homens",
                "dep_h": "conj",
                "pos_h": "NOUN",
                "lemma_h": "fim",
                "dep_c": "obj",
                "pos_c": "NOUN",
                "lemma_c": "homem",
                "categories": [
                    "outro"
                ],
                "pch_dependencies": []
            }
        ]
    },
    {
        "class": "PESSOA",
        "entity": "asverus",
        "sentence": "Ahasverus.",
        "start_char": 396,
        "end_char": 403,
        "excerpt": "Medita, depois sonha. Vai declinando o dia. Ahasverus.",
        "gender": "male",
        "pch_occurrences": null,
        "dependencies": []
    },
    {
        "class": "PESSOA",
        "entity": "Prometeu",
        "sentence": "Prometeu é o meu nome.",
        "start_char": 6649,
        "end_char": 6657,
        "excerpt": "Tu? Prometeu. Prometeu é o meu nome.",
        "gender": "male",
        "pch_occurrences": null,
        "dependencies": [
            {
                "head": "Prometeu",
                "child": "nome",
                "dep_h": "nsubj",
                "pos_h": "PROPN",
                "lemma_h": "Prometeu",
                "dep_c": "ROOT",
                "pos_c": "NOUN",
                "lemma_c": "nome",
                "categories": [],
                "pch_dependencies": []
            },
            {
                "head": "nome",
                "child": "Prometeu",
                "dep_h": "ROOT",
                "pos_h": "NOUN",
                "lemma_h": "nome",
                "dep_c": "nsubj",
                "pos_c": "PROPN",
                "lemma_c": "Prometeu",
                "categories": [],
                "pch_dependencies": []
            }
        ]
    },
    {
        "class": "PESSOA",
        "entity": "asverus",
        "sentence": "Ahasverus.",
        "start_char": 396,
        "end_char": 403,
        "excerpt": "Medita, depois sonha. Vai declinando o dia. Ahasverus.",
        "gender": "male",
        "pch_occurrences": null,
        "dependencies": []
    },
    {
        "class": "PESSOA",
        "entity": "Tu Prometeu",
        "sentence": "Tu Prometeu?",
        "start_char": 6683,
        "end_char": 6694,
        "excerpt": "Prometeu é o meu nome. Ahasverus. Tu Prometeu?",
        "gender": "male",
        "pch_occurrences": null,
        "dependencies": []
    },
    {
        "class": "PESSOA",
        "entity": "Júpiter",
        "sentence": "Tal foi o meu crime. Júpiter, que então regia o Olimpo, condenou-me ao mais cruel suplício.",
        "start_char": 6849,
        "end_char": 6856,
        "excerpt": "E qual foi o meu crime? Fiz de lodo e água os primeiros homens, e depois, compadecido, roubei para eles o fogo do céu. Tal foi o meu crime. Júpiter, que então regia o Olimpo, condenou-me ao mais cruel suplício.",
        "gender": "male",
        "pch_occurrences": null,
        "dependencies": [
            {
                "head": "condenou-me",
                "child": "Júpiter",
                "dep_h": "ROOT",
                "pos_h": "VERB",
                "lemma_h": "condenou-me",
                "dep_c": "nsubj",
                "pos_c": "PROPN",
                "lemma_c": "Júpiter",
                "categories": [],
                "pch_dependencies": []
            }
        ]
    },
    {
        "class": "PESSOA",
        "entity": "asverus",
        "sentence": "Ahasverus.",
        "start_char": 396,
        "end_char": 403,
        "excerpt": "Medita, depois sonha. Vai declinando o dia. Ahasverus.",
        "gender": "male",
        "pch_occurrences": null,
        "dependencies": []
    },
    {
        "class": "PESSOA",
        "entity": "helênico",
        "sentence": "Conheço esse sonho helênico.",
        "start_char": 7006,
        "end_char": 7014,
        "excerpt": "Ahasverus. Chego à cláusula dos tempos; este é o limiar da eternidade. A terra está deserta; nenhum outro homem respira o ar da vida. Sou o último; posso morrer. Morrer! Deliciosa idéia! Séculos de séculos vivi, cansado, mortificado, andando sempre, mas ei-los que acabam e vou morrer com eles. Velha natureza, adeus! Céu azul, imenso céu for aberto para que desçam os espíritos da vida nova, terra inimiga, que me não comeste os ossos, adeus! O errante não errará mais. Deus me perdoará, se quiser, mas a morte consola-me. Aquela montanha é áspera como a minha dor; aquelas águias, que ali passam, devem ser famintas como o meu desespero. Morrereis também, águias divinas? Prometeu. Certo que os homens acabaram; a terra está nua deles. Ahasverus. Ouço ainda uma voz... Voz de homem? Céus implacáveis, não sou então o último? Ei-lo que se aproxima... Quem és tu? Há em teus grandes olhos alguma cousa parecida com a luz misteriosa dos arcanjos de Israel; não és homem... Prometeu. Não. Ahasverus. Raça divina? Prometeu. Tu o disseste. Ahasverus. Não te conheço; mas que importa que te não conheça? Não és homem; posso então morrer; pois sou o último, e fecho a porta da vida. Prometeu. A vida, como a antiga Tebas, tem cem portas. Fechas uma, outras se abrirão. És o último da tua espécie? Virá outra espécie melhor, não feita do mesmo barro, mas da mesma luz. Sim, homem derradeiro, toda a plebe dos espíritos perecerá para sempre; a flor deles é que voltará à terra para reger as coisas. Os tempos serão retificados. O mal acabará; os ventos não espalharão mais nem os germes da morte, nem o clamor dos oprimidos, mas tão somente a cantiga do amor perene e a bênção da universal justiça... Ahasverus. Que importa à espécie que vai morrer comigo toda essa delícia póstuma? Crê-me, tu que és imortal, para os ossos que apodrecem na terra as púrpuras de Sidônia não valem nada. O que tu me contas é ainda melhor que o sonho de Campanella. Na cidade deste havia delitos e enfermidades; a tua exclui todas as lesões morais e físicas. O Senhor te ouça! Mas deixa-me ir morrer. Prometeu. Vai, vai. Que pressa tens em acabar os teus dias? Ahasverus. A pressa de um homem que tem vivido milheiros de anos. Sim, milheiros de anos. Homens que apenas respiraram por dezenas deles, inventaram um sentimento de enfado, tedium vitae, que eles nunca puderam conhecer, ao menos em toda a sua implacável e vasta realidade, porque é preciso haver calcado, como eu, todas as gerações e todas as ruínas, para experimentar esse profundo fastio da existência. Prometeu. Milheiros de anos? Ahasverus. Meu nome é Ahasverus: vivia em Jerusalém, ao tempo em que iam crucificar Jesus Cristo. Quando ele passou pela minha porta, afrouxou ao peso do madeiro que levava aos ombros, e eu empurrei-o, bradando-lhe que não parasse, 2  que não descansasse, que fosse andando até à colina, onde tinha de ser crucificado... Então uma voz anunciou-me do céu que eu andaria sempre, continuamente, até o fim dos tempos. Tal é a minha culpa; não tive piedade para com aquele que ia morrer. Não sei mesmo como isto foi. Os fariseus diziam que o filho de Maria vinha destruir a lei, e que era preciso matá-lo; eu, pobre ignorante, quis realçar o meu zelo e daí a ação daquele dia. Que de vezes vi isto mesmo, depois, atravessando os tempos e as cidades! Onde quer que o zelo penetrou numa alma subalterna, fez-se cruel ou ridículo. Foi a minha culpa irremissível. Prometeu. Grave culpa, em verdade, mas a pena foi benévola. Os outros homens leram da vida um capítulo, tu leste o livro inteiro. Que sabe um capítulo de outro capítulo? Nada; mas o que os leu a todos, liga-os e conclui. Há páginas melancólicas? Há outras joviais e felizes. À convulsão trágica precede a do riso, a vida brota da morte, cegonhas e andorinhas trocam de clima, sem jamais abandoná- lo inteiramente; é assim que tudo se concerta e restitui. Tu viste isso, não dez vezes, não mil vezes, mas todas as vezes; viste a magnificência da terra curando a aflição da alma, e a alegria da alma suprindo à desolação das cousas; dança alternada da natureza, que dá a mão esquerda a Jó e a direita a Sardanapalo. Ahasverus. Que sabes tu da minha vida? Nada; ignoras a vida humana. Prometeu. Ignoro a vida humana? Deixa-me rir! Eia, homem perpétuo, explica-te. Conta-me tudo; saíste de Jerusalém... Ahasverus. Saí de Jerusalém. Comecei a peregrinação dos tempos. Ia a toda parte, qualquer que fosse a raça, o culto ou a língua; sóis e neves, povos bárbaros e cultos, ilhas, continentes, onde quer que respirasse um homem aí respirei eu. Nunca mais trabalhei. Trabalho é refúgio, e não tive esse refúgio. Cada manhã achava comigo a moeda do dia... Vede; cá está a última. Ide, que já não sois precisa (atira a moeda ao longe). Não trabalhava, andava apenas, sempre, sempre, sempre, um dia e outro dia, um ano e outro ano, e todos os anos, e todos os séculos. A eterna justiça soube o que fez: somou a eternidade com a ociosidade. As gerações legavam-me umas às outras. As línguas que morriam ficavam com o meu nome embutido na ossada. Com o volver dos tempos, esquecia-se tudo; os heróis dissipavam-se em mitos, na penumbra, ao longe; e a história ia caindo aos pedaços, não lhe ficando mais que duas ou três feições vagas e remotas. E eu via-as de um modo e de outro modo. Falaste em capítulo? Os que se foram, à nascença dos impérios, levaram a impressão da perpetuidade deles; os que expiraram quando eles decaíam, enterraram-se com a esperança da recomposição; mas sabes tu o que é ver as mesmas cousas, sem parar, a mesma alternativa de prosperidade e desolação, desolação e prosperidade, eternas exéquias e eternas aleluias, auroras sobre auroras, ocasos sobre ocasos? Prometeu. Mas não padeceste, creio; é alguma cousa não padecer nada. Ahasverus. Sim, mas vi padecer os outros homens, e para o fim o espetáculo da alegria dava-me a mesma sensação que os discursos de um doido. Fatalidades do sangue e da carne, conflitos sem fim, tudo vi passar a meus olhos, a ponto que a noite me fez perder o gosto ao dia, e acabo não distinguindo as flores das urzes. Tudo se me confunde na retina enfarada. Prometeu. Pessoalmente não te doeu nada; e eu que padeci por tempos inúmeros o efeito da cólera divina? Ahasverus. Tu? Prometeu. Prometeu é o meu nome. Ahasverus. Tu Prometeu? 3  Prometeu. E qual foi o meu crime? Fiz de lodo e água os primeiros homens, e depois, compadecido, roubei para eles o fogo do céu. Tal foi o meu crime. Júpiter, que então regia o Olimpo, condenou-me ao mais cruel suplício. Anda, sobe comigo a este rochedo. Ahasverus. Contas-me uma fábula. Conheço esse sonho helênico.",
        "gender": "male",
        "pch_occurrences": {
            "olho": {
                "syns": [
                    "olhos"
                ],
                "occurrences": [
                    "olhos",
                    "olhos",
                    "olho",
                    "olho"
                ],
                "occurrences_n": 4
            },
            "ombro": {
                "syns": [
                    "ombros"
                ],
                "occurrences": [
                    "ombros",
                    "ombro"
                ],
                "occurrences_n": 2
            },
            "mão": {
                "syns": [
                    "mãos"
                ],
                "occurrences": [
                    "mão"
                ],
                "occurrences_n": 1
            },
            "osso": {
                "syns": [
                    "ossos"
                ],
                "occurrences": [
                    "osso",
                    "osso",
                    "ossos",
                    "ossos"
                ],
                "occurrences_n": 4
            },
            "língua": {
                "syns": [
                    "línguas"
                ],
                "occurrences": [
                    "línguas",
                    "língua",
                    "língua"
                ],
                "occurrences_n": 3
            }
        },
        "dependencies": [
            {
                "head": "esse sonho",
                "child": "helênico",
                "dep_h": "obj",
                "pos_h": "NOUN",
                "lemma_h": "sonho",
                "dep_c": "amod",
                "pos_c": "ADJ",
                "lemma_c": "helênico",
                "categories": [],
                "pch_dependencies": []
            }
        ]
    },
    {
        "class": "PESSOA",
        "entity": "Velho incrédulo",
        "sentence": "Velho incrédulo!",
        "start_char": 7026,
        "end_char": 7041,
        "excerpt": "Conheço esse sonho helênico. Prometeu. Velho incrédulo!",
        "gender": "unknown",
        "pch_occurrences": null,
        "dependencies": []
    },
    {
        "class": "PESSOA",
        "entity": "asverus",
        "sentence": "Ahasverus.",
        "start_char": 396,
        "end_char": 403,
        "excerpt": "Medita, depois sonha. Vai declinando o dia. Ahasverus.",
        "gender": "male",
        "pch_occurrences": null,
        "dependencies": []
    },
    {
        "class": "PESSOA",
        "entity": "Vulcano",
        "sentence": "Eram de mão divina; fabricou-as Vulcano.",
        "start_char": 7305,
        "end_char": 7312,
        "excerpt": "O tempo que tudo rói não as quis então? Prometeu. Eram de mão divina; fabricou-as Vulcano.",
        "gender": "male",
        "pch_occurrences": {
            "mão": {
                "syns": [
                    "mãos"
                ],
                "occurrences": [
                    "mão"
                ],
                "occurrences_n": 1
            }
        },
        "dependencies": []
    },
    {
        "class": "PESSOA",
        "entity": "asverus",
        "sentence": "Ahasverus.",
        "start_char": 396,
        "end_char": 403,
        "excerpt": "Medita, depois sonha. Vai declinando o dia. Ahasverus.",
        "gender": "male",
        "pch_occurrences": null,
        "dependencies": []
    },
    {
        "class": "PESSOA",
        "entity": "Tu Prometeu",
        "sentence": "Tu Prometeu?",
        "start_char": 6683,
        "end_char": 6694,
        "excerpt": "Prometeu é o meu nome. Ahasverus. Tu Prometeu?",
        "gender": "male",
        "pch_occurrences": null,
        "dependencies": []
    },
    {
        "class": "PESSOA",
        "entity": "asverus",
        "sentence": "Ahasverus.",
        "start_char": 396,
        "end_char": 403,
        "excerpt": "Medita, depois sonha. Vai declinando o dia. Ahasverus.",
        "gender": "male",
        "pch_occurrences": null,
        "dependencies": []
    },
    {
        "class": "PESSOA",
        "entity": "Moisés",
        "sentence": "Moisés mentiu-me.",
        "start_char": 7687,
        "end_char": 7693,
        "excerpt": "Vê se existo. Ahasverus. Moisés mentiu-me.",
        "gender": "male",
        "pch_occurrences": null,
        "dependencies": [
            {
                "head": "Moisés",
                "child": "mentiu-me",
                "dep_h": "nsubj",
                "pos_h": "PROPN",
                "lemma_h": "Moisés",
                "dep_c": "ROOT",
                "pos_c": "PROPN",
                "lemma_c": "mentiu-me",
                "categories": [],
                "pch_dependencies": []
            },
            {
                "head": "mentiu-me",
                "child": "Moisés",
                "dep_h": "ROOT",
                "pos_h": "PROPN",
                "lemma_h": "mentiu-me",
                "dep_c": "nsubj",
                "pos_c": "PROPN",
                "lemma_c": "Moisés",
                "categories": [],
                "pch_dependencies": []
            }
        ]
    },
    {
        "class": "PESSOA",
        "entity": "Prometeu",
        "sentence": "Tu Prometeu, criador dos primeiros homens?",
        "start_char": 7708,
        "end_char": 7716,
        "excerpt": "Ahasverus. Chego à cláusula dos tempos; este é o limiar da eternidade. A terra está deserta; nenhum outro homem respira o ar da vida. Sou o último; posso morrer. Morrer! Deliciosa idéia! Séculos de séculos vivi, cansado, mortificado, andando sempre, mas ei-los que acabam e vou morrer com eles. Velha natureza, adeus! Céu azul, imenso céu for aberto para que desçam os espíritos da vida nova, terra inimiga, que me não comeste os ossos, adeus! O errante não errará mais. Deus me perdoará, se quiser, mas a morte consola-me. Aquela montanha é áspera como a minha dor; aquelas águias, que ali passam, devem ser famintas como o meu desespero. Morrereis também, águias divinas? Prometeu. Certo que os homens acabaram; a terra está nua deles. Ahasverus. Ouço ainda uma voz... Voz de homem? Céus implacáveis, não sou então o último? Ei-lo que se aproxima... Quem és tu? Há em teus grandes olhos alguma cousa parecida com a luz misteriosa dos arcanjos de Israel; não és homem... Prometeu. Não. Ahasverus. Raça divina? Prometeu. Tu o disseste. Ahasverus. Não te conheço; mas que importa que te não conheça? Não és homem; posso então morrer; pois sou o último, e fecho a porta da vida. Prometeu. A vida, como a antiga Tebas, tem cem portas. Fechas uma, outras se abrirão. És o último da tua espécie? Virá outra espécie melhor, não feita do mesmo barro, mas da mesma luz. Sim, homem derradeiro, toda a plebe dos espíritos perecerá para sempre; a flor deles é que voltará à terra para reger as coisas. Os tempos serão retificados. O mal acabará; os ventos não espalharão mais nem os germes da morte, nem o clamor dos oprimidos, mas tão somente a cantiga do amor perene e a bênção da universal justiça... Ahasverus. Que importa à espécie que vai morrer comigo toda essa delícia póstuma? Crê-me, tu que és imortal, para os ossos que apodrecem na terra as púrpuras de Sidônia não valem nada. O que tu me contas é ainda melhor que o sonho de Campanella. Na cidade deste havia delitos e enfermidades; a tua exclui todas as lesões morais e físicas. O Senhor te ouça! Mas deixa-me ir morrer. Prometeu. Vai, vai. Que pressa tens em acabar os teus dias? Ahasverus. A pressa de um homem que tem vivido milheiros de anos. Sim, milheiros de anos. Homens que apenas respiraram por dezenas deles, inventaram um sentimento de enfado, tedium vitae, que eles nunca puderam conhecer, ao menos em toda a sua implacável e vasta realidade, porque é preciso haver calcado, como eu, todas as gerações e todas as ruínas, para experimentar esse profundo fastio da existência. Prometeu. Milheiros de anos? Ahasverus. Meu nome é Ahasverus: vivia em Jerusalém, ao tempo em que iam crucificar Jesus Cristo. Quando ele passou pela minha porta, afrouxou ao peso do madeiro que levava aos ombros, e eu empurrei-o, bradando-lhe que não parasse, 2  que não descansasse, que fosse andando até à colina, onde tinha de ser crucificado... Então uma voz anunciou-me do céu que eu andaria sempre, continuamente, até o fim dos tempos. Tal é a minha culpa; não tive piedade para com aquele que ia morrer. Não sei mesmo como isto foi. Os fariseus diziam que o filho de Maria vinha destruir a lei, e que era preciso matá-lo; eu, pobre ignorante, quis realçar o meu zelo e daí a ação daquele dia. Que de vezes vi isto mesmo, depois, atravessando os tempos e as cidades! Onde quer que o zelo penetrou numa alma subalterna, fez-se cruel ou ridículo. Foi a minha culpa irremissível. Prometeu. Grave culpa, em verdade, mas a pena foi benévola. Os outros homens leram da vida um capítulo, tu leste o livro inteiro. Que sabe um capítulo de outro capítulo? Nada; mas o que os leu a todos, liga-os e conclui. Há páginas melancólicas? Há outras joviais e felizes. À convulsão trágica precede a do riso, a vida brota da morte, cegonhas e andorinhas trocam de clima, sem jamais abandoná- lo inteiramente; é assim que tudo se concerta e restitui. Tu viste isso, não dez vezes, não mil vezes, mas todas as vezes; viste a magnificência da terra curando a aflição da alma, e a alegria da alma suprindo à desolação das cousas; dança alternada da natureza, que dá a mão esquerda a Jó e a direita a Sardanapalo. Ahasverus. Que sabes tu da minha vida? Nada; ignoras a vida humana. Prometeu. Ignoro a vida humana? Deixa-me rir! Eia, homem perpétuo, explica-te. Conta-me tudo; saíste de Jerusalém... Ahasverus. Saí de Jerusalém. Comecei a peregrinação dos tempos. Ia a toda parte, qualquer que fosse a raça, o culto ou a língua; sóis e neves, povos bárbaros e cultos, ilhas, continentes, onde quer que respirasse um homem aí respirei eu. Nunca mais trabalhei. Trabalho é refúgio, e não tive esse refúgio. Cada manhã achava comigo a moeda do dia... Vede; cá está a última. Ide, que já não sois precisa (atira a moeda ao longe). Não trabalhava, andava apenas, sempre, sempre, sempre, um dia e outro dia, um ano e outro ano, e todos os anos, e todos os séculos. A eterna justiça soube o que fez: somou a eternidade com a ociosidade. As gerações legavam-me umas às outras. As línguas que morriam ficavam com o meu nome embutido na ossada. Com o volver dos tempos, esquecia-se tudo; os heróis dissipavam-se em mitos, na penumbra, ao longe; e a história ia caindo aos pedaços, não lhe ficando mais que duas ou três feições vagas e remotas. E eu via-as de um modo e de outro modo. Falaste em capítulo? Os que se foram, à nascença dos impérios, levaram a impressão da perpetuidade deles; os que expiraram quando eles decaíam, enterraram-se com a esperança da recomposição; mas sabes tu o que é ver as mesmas cousas, sem parar, a mesma alternativa de prosperidade e desolação, desolação e prosperidade, eternas exéquias e eternas aleluias, auroras sobre auroras, ocasos sobre ocasos? Prometeu. Mas não padeceste, creio; é alguma cousa não padecer nada. Ahasverus. Sim, mas vi padecer os outros homens, e para o fim o espetáculo da alegria dava-me a mesma sensação que os discursos de um doido. Fatalidades do sangue e da carne, conflitos sem fim, tudo vi passar a meus olhos, a ponto que a noite me fez perder o gosto ao dia, e acabo não distinguindo as flores das urzes. Tudo se me confunde na retina enfarada. Prometeu. Pessoalmente não te doeu nada; e eu que padeci por tempos inúmeros o efeito da cólera divina? Ahasverus. Tu? Prometeu. Prometeu é o meu nome. Ahasverus. Tu Prometeu? 3  Prometeu. E qual foi o meu crime? Fiz de lodo e água os primeiros homens, e depois, compadecido, roubei para eles o fogo do céu. Tal foi o meu crime. Júpiter, que então regia o Olimpo, condenou-me ao mais cruel suplício. Anda, sobe comigo a este rochedo. Ahasverus. Contas-me uma fábula. Conheço esse sonho helênico. Prometeu. Velho incrédulo! Anda ver as próprias correntes que me agrilhoaram; foi uma pena excessiva para nenhuma culpa; mas a divindade orgulhosa e terrível... Chegamos, olha, aqui estão elas... Ahasverus. O tempo que tudo rói não as quis então? Prometeu. Eram de mão divina; fabricou-as Vulcano. Dois emissários do céu vieram atar-me ao rochedo, e uma águia, como aquela que lá corta o horizonte, comia-me o fígado, sem consumi-lo nunca. Durou isto tempos que não contei. Não, não podes imaginar este suplício... Ahasverus. Não me iludes? Tu Prometeu? Não foi então um sonho da imaginação antiga? Prometeu. Olha bem para mim, palpa estas mãos. Vê se existo. Ahasverus. Moisés mentiu-me. Tu Prometeu, criador dos primeiros homens?",
        "gender": "male",
        "pch_occurrences": {
            "olho": {
                "syns": [
                    "olhos"
                ],
                "occurrences": [
                    "olhos",
                    "olhos",
                    "olho",
                    "olho"
                ],
                "occurrences_n": 4
            },
            "ombro": {
                "syns": [
                    "ombros"
                ],
                "occurrences": [
                    "ombros",
                    "ombro"
                ],
                "occurrences_n": 2
            },
            "mão": {
                "syns": [
                    "mãos"
                ],
                "occurrences": [
                    "mão",
                    "mão",
                    "mão",
                    "mãos"
                ],
                "occurrences_n": 4
            },
            "osso": {
                "syns": [
                    "ossos"
                ],
                "occurrences": [
                    "osso",
                    "osso",
                    "ossos",
                    "ossos"
                ],
                "occurrences_n": 4
            },
            "língua": {
                "syns": [
                    "línguas"
                ],
                "occurrences": [
                    "línguas",
                    "língua",
                    "língua"
                ],
                "occurrences_n": 3
            }
        },
        "dependencies": [
            {
                "head": "Prometeu",
                "child": "nome",
                "dep_h": "nsubj",
                "pos_h": "PROPN",
                "lemma_h": "Prometeu",
                "dep_c": "ROOT",
                "pos_c": "NOUN",
                "lemma_c": "nome",
                "categories": [],
                "pch_dependencies": []
            },
            {
                "head": "nome",
                "child": "Prometeu",
                "dep_h": "ROOT",
                "pos_h": "NOUN",
                "lemma_h": "nome",
                "dep_c": "nsubj",
                "pos_c": "PROPN",
                "lemma_c": "Prometeu",
                "categories": [],
                "pch_dependencies": []
            }
        ]
    },
    {
        "class": "PESSOA",
        "entity": "criador",
        "sentence": "Tu Prometeu, criador dos primeiros homens?",
        "start_char": 7718,
        "end_char": 7725,
        "excerpt": "Ahasverus. Chego à cláusula dos tempos; este é o limiar da eternidade. A terra está deserta; nenhum outro homem respira o ar da vida. Sou o último; posso morrer. Morrer! Deliciosa idéia! Séculos de séculos vivi, cansado, mortificado, andando sempre, mas ei-los que acabam e vou morrer com eles. Velha natureza, adeus! Céu azul, imenso céu for aberto para que desçam os espíritos da vida nova, terra inimiga, que me não comeste os ossos, adeus! O errante não errará mais. Deus me perdoará, se quiser, mas a morte consola-me. Aquela montanha é áspera como a minha dor; aquelas águias, que ali passam, devem ser famintas como o meu desespero. Morrereis também, águias divinas? Prometeu. Certo que os homens acabaram; a terra está nua deles. Ahasverus. Ouço ainda uma voz... Voz de homem? Céus implacáveis, não sou então o último? Ei-lo que se aproxima... Quem és tu? Há em teus grandes olhos alguma cousa parecida com a luz misteriosa dos arcanjos de Israel; não és homem... Prometeu. Não. Ahasverus. Raça divina? Prometeu. Tu o disseste. Ahasverus. Não te conheço; mas que importa que te não conheça? Não és homem; posso então morrer; pois sou o último, e fecho a porta da vida. Prometeu. A vida, como a antiga Tebas, tem cem portas. Fechas uma, outras se abrirão. És o último da tua espécie? Virá outra espécie melhor, não feita do mesmo barro, mas da mesma luz. Sim, homem derradeiro, toda a plebe dos espíritos perecerá para sempre; a flor deles é que voltará à terra para reger as coisas. Os tempos serão retificados. O mal acabará; os ventos não espalharão mais nem os germes da morte, nem o clamor dos oprimidos, mas tão somente a cantiga do amor perene e a bênção da universal justiça... Ahasverus. Que importa à espécie que vai morrer comigo toda essa delícia póstuma? Crê-me, tu que és imortal, para os ossos que apodrecem na terra as púrpuras de Sidônia não valem nada. O que tu me contas é ainda melhor que o sonho de Campanella. Na cidade deste havia delitos e enfermidades; a tua exclui todas as lesões morais e físicas. O Senhor te ouça! Mas deixa-me ir morrer. Prometeu. Vai, vai. Que pressa tens em acabar os teus dias? Ahasverus. A pressa de um homem que tem vivido milheiros de anos. Sim, milheiros de anos. Homens que apenas respiraram por dezenas deles, inventaram um sentimento de enfado, tedium vitae, que eles nunca puderam conhecer, ao menos em toda a sua implacável e vasta realidade, porque é preciso haver calcado, como eu, todas as gerações e todas as ruínas, para experimentar esse profundo fastio da existência. Prometeu. Milheiros de anos? Ahasverus. Meu nome é Ahasverus: vivia em Jerusalém, ao tempo em que iam crucificar Jesus Cristo. Quando ele passou pela minha porta, afrouxou ao peso do madeiro que levava aos ombros, e eu empurrei-o, bradando-lhe que não parasse, 2  que não descansasse, que fosse andando até à colina, onde tinha de ser crucificado... Então uma voz anunciou-me do céu que eu andaria sempre, continuamente, até o fim dos tempos. Tal é a minha culpa; não tive piedade para com aquele que ia morrer. Não sei mesmo como isto foi. Os fariseus diziam que o filho de Maria vinha destruir a lei, e que era preciso matá-lo; eu, pobre ignorante, quis realçar o meu zelo e daí a ação daquele dia. Que de vezes vi isto mesmo, depois, atravessando os tempos e as cidades! Onde quer que o zelo penetrou numa alma subalterna, fez-se cruel ou ridículo. Foi a minha culpa irremissível. Prometeu. Grave culpa, em verdade, mas a pena foi benévola. Os outros homens leram da vida um capítulo, tu leste o livro inteiro. Que sabe um capítulo de outro capítulo? Nada; mas o que os leu a todos, liga-os e conclui. Há páginas melancólicas? Há outras joviais e felizes. À convulsão trágica precede a do riso, a vida brota da morte, cegonhas e andorinhas trocam de clima, sem jamais abandoná- lo inteiramente; é assim que tudo se concerta e restitui. Tu viste isso, não dez vezes, não mil vezes, mas todas as vezes; viste a magnificência da terra curando a aflição da alma, e a alegria da alma suprindo à desolação das cousas; dança alternada da natureza, que dá a mão esquerda a Jó e a direita a Sardanapalo. Ahasverus. Que sabes tu da minha vida? Nada; ignoras a vida humana. Prometeu. Ignoro a vida humana? Deixa-me rir! Eia, homem perpétuo, explica-te. Conta-me tudo; saíste de Jerusalém... Ahasverus. Saí de Jerusalém. Comecei a peregrinação dos tempos. Ia a toda parte, qualquer que fosse a raça, o culto ou a língua; sóis e neves, povos bárbaros e cultos, ilhas, continentes, onde quer que respirasse um homem aí respirei eu. Nunca mais trabalhei. Trabalho é refúgio, e não tive esse refúgio. Cada manhã achava comigo a moeda do dia... Vede; cá está a última. Ide, que já não sois precisa (atira a moeda ao longe). Não trabalhava, andava apenas, sempre, sempre, sempre, um dia e outro dia, um ano e outro ano, e todos os anos, e todos os séculos. A eterna justiça soube o que fez: somou a eternidade com a ociosidade. As gerações legavam-me umas às outras. As línguas que morriam ficavam com o meu nome embutido na ossada. Com o volver dos tempos, esquecia-se tudo; os heróis dissipavam-se em mitos, na penumbra, ao longe; e a história ia caindo aos pedaços, não lhe ficando mais que duas ou três feições vagas e remotas. E eu via-as de um modo e de outro modo. Falaste em capítulo? Os que se foram, à nascença dos impérios, levaram a impressão da perpetuidade deles; os que expiraram quando eles decaíam, enterraram-se com a esperança da recomposição; mas sabes tu o que é ver as mesmas cousas, sem parar, a mesma alternativa de prosperidade e desolação, desolação e prosperidade, eternas exéquias e eternas aleluias, auroras sobre auroras, ocasos sobre ocasos? Prometeu. Mas não padeceste, creio; é alguma cousa não padecer nada. Ahasverus. Sim, mas vi padecer os outros homens, e para o fim o espetáculo da alegria dava-me a mesma sensação que os discursos de um doido. Fatalidades do sangue e da carne, conflitos sem fim, tudo vi passar a meus olhos, a ponto que a noite me fez perder o gosto ao dia, e acabo não distinguindo as flores das urzes. Tudo se me confunde na retina enfarada. Prometeu. Pessoalmente não te doeu nada; e eu que padeci por tempos inúmeros o efeito da cólera divina? Ahasverus. Tu? Prometeu. Prometeu é o meu nome. Ahasverus. Tu Prometeu? 3  Prometeu. E qual foi o meu crime? Fiz de lodo e água os primeiros homens, e depois, compadecido, roubei para eles o fogo do céu. Tal foi o meu crime. Júpiter, que então regia o Olimpo, condenou-me ao mais cruel suplício. Anda, sobe comigo a este rochedo. Ahasverus. Contas-me uma fábula. Conheço esse sonho helênico. Prometeu. Velho incrédulo! Anda ver as próprias correntes que me agrilhoaram; foi uma pena excessiva para nenhuma culpa; mas a divindade orgulhosa e terrível... Chegamos, olha, aqui estão elas... Ahasverus. O tempo que tudo rói não as quis então? Prometeu. Eram de mão divina; fabricou-as Vulcano. Dois emissários do céu vieram atar-me ao rochedo, e uma águia, como aquela que lá corta o horizonte, comia-me o fígado, sem consumi-lo nunca. Durou isto tempos que não contei. Não, não podes imaginar este suplício... Ahasverus. Não me iludes? Tu Prometeu? Não foi então um sonho da imaginação antiga? Prometeu. Olha bem para mim, palpa estas mãos. Vê se existo. Ahasverus. Moisés mentiu-me. Tu Prometeu, criador dos primeiros homens?",
        "gender": "male",
        "pch_occurrences": {
            "olho": {
                "syns": [
                    "olhos"
                ],
                "occurrences": [
                    "olhos",
                    "olhos",
                    "olho",
                    "olho"
                ],
                "occurrences_n": 4
            },
            "ombro": {
                "syns": [
                    "ombros"
                ],
                "occurrences": [
                    "ombros",
                    "ombro"
                ],
                "occurrences_n": 2
            },
            "mão": {
                "syns": [
                    "mãos"
                ],
                "occurrences": [
                    "mão",
                    "mão",
                    "mão",
                    "mãos"
                ],
                "occurrences_n": 4
            },
            "osso": {
                "syns": [
                    "ossos"
                ],
                "occurrences": [
                    "osso",
                    "osso",
                    "ossos",
                    "ossos"
                ],
                "occurrences_n": 4
            },
            "língua": {
                "syns": [
                    "línguas"
                ],
                "occurrences": [
                    "línguas",
                    "língua",
                    "língua"
                ],
                "occurrences_n": 3
            }
        },
        "dependencies": []
    },
    {
        "class": "PESSOA",
        "entity": "asverus",
        "sentence": "Ahasverus.",
        "start_char": 396,
        "end_char": 403,
        "excerpt": "Medita, depois sonha. Vai declinando o dia. Ahasverus.",
        "gender": "male",
        "pch_occurrences": null,
        "dependencies": []
    },
    {
        "class": "PESSOA",
        "entity": "artífice do inferno",
        "sentence": "Sim, foi o teu crime, artífice do inferno; foi o teu crime inexplicável.",
        "start_char": 7808,
        "end_char": 7827,
        "excerpt": "Foi o meu crime. Ahasverus. Sim, foi o teu crime, artífice do inferno; foi o teu crime inexplicável.",
        "gender": "unknown",
        "pch_occurrences": null,
        "dependencies": []
    },
    {
        "class": "PESSOA",
        "entity": "asverus",
        "sentence": "Ahasverus.",
        "start_char": 396,
        "end_char": 403,
        "excerpt": "Medita, depois sonha. Vai declinando o dia. Ahasverus.",
        "gender": "male",
        "pch_occurrences": null,
        "dependencies": []
    },
    {
        "class": "PESSOA",
        "entity": "asverus",
        "sentence": "Ahasverus.",
        "start_char": 396,
        "end_char": 403,
        "excerpt": "Medita, depois sonha. Vai declinando o dia. Ahasverus.",
        "gender": "male",
        "pch_occurrences": null,
        "dependencies": []
    },
    {
        "class": "PESSOA",
        "entity": "último homem",
        "sentence": "Ouve, último homem, último ingrato!",
        "start_char": 8376,
        "end_char": 8388,
        "excerpt": "Ela chorou muito mais por tua culpa. Prometeu. Ouve, último homem, último ingrato!",
        "gender": "male",
        "pch_occurrences": null,
        "dependencies": [
            {
                "head": "Ouve",
                "child": ", último homem",
                "dep_h": "ROOT",
                "pos_h": "PROPN",
                "lemma_h": "Ouve",
                "dep_c": "appos",
                "pos_c": "NOUN",
                "lemma_c": "homem",
                "categories": [
                    "outro"
                ],
                "pch_dependencies": []
            },
            {
                "head": ", último homem",
                "child": "Ouve",
                "dep_h": "appos",
                "pos_h": "NOUN",
                "lemma_h": "homem",
                "dep_c": "ROOT",
                "pos_c": "PROPN",
                "lemma_c": "Ouve",
                "categories": [
                    "outro"
                ],
                "pch_dependencies": []
            }
        ]
    },
    {
        "class": "PESSOA",
        "entity": "último ingrato",
        "sentence": "Ouve, último homem, último ingrato!",
        "start_char": 8390,
        "end_char": 8404,
        "excerpt": "Ela chorou muito mais por tua culpa. Prometeu. Ouve, último homem, último ingrato!",
        "gender": "male",
        "pch_occurrences": null,
        "dependencies": [
            {
                "head": "Ouve",
                "child": ", último ingrato",
                "dep_h": "ROOT",
                "pos_h": "PROPN",
                "lemma_h": "Ouve",
                "dep_c": "conj",
                "pos_c": "NOUN",
                "lemma_c": "ingrato",
                "categories": [
                    "carater_emo"
                ],
                "pch_dependencies": []
            },
            {
                "head": ", último ingrato",
                "child": "Ouve",
                "dep_h": "conj",
                "pos_h": "NOUN",
                "lemma_h": "ingrato",
                "dep_c": "ROOT",
                "pos_c": "PROPN",
                "lemma_c": "Ouve",
                "categories": [
                    "carater_emo"
                ],
                "pch_dependencies": []
            }
        ]
    },
    {
        "class": "PESSOA",
        "entity": "asverus",
        "sentence": "Ahasverus.",
        "start_char": 396,
        "end_char": 403,
        "excerpt": "Medita, depois sonha. Vai declinando o dia. Ahasverus.",
        "gender": "male",
        "pch_occurrences": null,
        "dependencies": []
    },
    {
        "class": "PESSOA",
        "entity": "divindade",
        "sentence": "Quero os teus gemidos, divindade perversa.",
        "start_char": 8473,
        "end_char": 8482,
        "excerpt": "Ahasverus. Chego à cláusula dos tempos; este é o limiar da eternidade. A terra está deserta; nenhum outro homem respira o ar da vida. Sou o último; posso morrer. Morrer! Deliciosa idéia! Séculos de séculos vivi, cansado, mortificado, andando sempre, mas ei-los que acabam e vou morrer com eles. Velha natureza, adeus! Céu azul, imenso céu for aberto para que desçam os espíritos da vida nova, terra inimiga, que me não comeste os ossos, adeus! O errante não errará mais. Deus me perdoará, se quiser, mas a morte consola-me. Aquela montanha é áspera como a minha dor; aquelas águias, que ali passam, devem ser famintas como o meu desespero. Morrereis também, águias divinas? Prometeu. Certo que os homens acabaram; a terra está nua deles. Ahasverus. Ouço ainda uma voz... Voz de homem? Céus implacáveis, não sou então o último? Ei-lo que se aproxima... Quem és tu? Há em teus grandes olhos alguma cousa parecida com a luz misteriosa dos arcanjos de Israel; não és homem... Prometeu. Não. Ahasverus. Raça divina? Prometeu. Tu o disseste. Ahasverus. Não te conheço; mas que importa que te não conheça? Não és homem; posso então morrer; pois sou o último, e fecho a porta da vida. Prometeu. A vida, como a antiga Tebas, tem cem portas. Fechas uma, outras se abrirão. És o último da tua espécie? Virá outra espécie melhor, não feita do mesmo barro, mas da mesma luz. Sim, homem derradeiro, toda a plebe dos espíritos perecerá para sempre; a flor deles é que voltará à terra para reger as coisas. Os tempos serão retificados. O mal acabará; os ventos não espalharão mais nem os germes da morte, nem o clamor dos oprimidos, mas tão somente a cantiga do amor perene e a bênção da universal justiça... Ahasverus. Que importa à espécie que vai morrer comigo toda essa delícia póstuma? Crê-me, tu que és imortal, para os ossos que apodrecem na terra as púrpuras de Sidônia não valem nada. O que tu me contas é ainda melhor que o sonho de Campanella. Na cidade deste havia delitos e enfermidades; a tua exclui todas as lesões morais e físicas. O Senhor te ouça! Mas deixa-me ir morrer. Prometeu. Vai, vai. Que pressa tens em acabar os teus dias? Ahasverus. A pressa de um homem que tem vivido milheiros de anos. Sim, milheiros de anos. Homens que apenas respiraram por dezenas deles, inventaram um sentimento de enfado, tedium vitae, que eles nunca puderam conhecer, ao menos em toda a sua implacável e vasta realidade, porque é preciso haver calcado, como eu, todas as gerações e todas as ruínas, para experimentar esse profundo fastio da existência. Prometeu. Milheiros de anos? Ahasverus. Meu nome é Ahasverus: vivia em Jerusalém, ao tempo em que iam crucificar Jesus Cristo. Quando ele passou pela minha porta, afrouxou ao peso do madeiro que levava aos ombros, e eu empurrei-o, bradando-lhe que não parasse, 2  que não descansasse, que fosse andando até à colina, onde tinha de ser crucificado... Então uma voz anunciou-me do céu que eu andaria sempre, continuamente, até o fim dos tempos. Tal é a minha culpa; não tive piedade para com aquele que ia morrer. Não sei mesmo como isto foi. Os fariseus diziam que o filho de Maria vinha destruir a lei, e que era preciso matá-lo; eu, pobre ignorante, quis realçar o meu zelo e daí a ação daquele dia. Que de vezes vi isto mesmo, depois, atravessando os tempos e as cidades! Onde quer que o zelo penetrou numa alma subalterna, fez-se cruel ou ridículo. Foi a minha culpa irremissível. Prometeu. Grave culpa, em verdade, mas a pena foi benévola. Os outros homens leram da vida um capítulo, tu leste o livro inteiro. Que sabe um capítulo de outro capítulo? Nada; mas o que os leu a todos, liga-os e conclui. Há páginas melancólicas? Há outras joviais e felizes. À convulsão trágica precede a do riso, a vida brota da morte, cegonhas e andorinhas trocam de clima, sem jamais abandoná- lo inteiramente; é assim que tudo se concerta e restitui. Tu viste isso, não dez vezes, não mil vezes, mas todas as vezes; viste a magnificência da terra curando a aflição da alma, e a alegria da alma suprindo à desolação das cousas; dança alternada da natureza, que dá a mão esquerda a Jó e a direita a Sardanapalo. Ahasverus. Que sabes tu da minha vida? Nada; ignoras a vida humana. Prometeu. Ignoro a vida humana? Deixa-me rir! Eia, homem perpétuo, explica-te. Conta-me tudo; saíste de Jerusalém... Ahasverus. Saí de Jerusalém. Comecei a peregrinação dos tempos. Ia a toda parte, qualquer que fosse a raça, o culto ou a língua; sóis e neves, povos bárbaros e cultos, ilhas, continentes, onde quer que respirasse um homem aí respirei eu. Nunca mais trabalhei. Trabalho é refúgio, e não tive esse refúgio. Cada manhã achava comigo a moeda do dia... Vede; cá está a última. Ide, que já não sois precisa (atira a moeda ao longe). Não trabalhava, andava apenas, sempre, sempre, sempre, um dia e outro dia, um ano e outro ano, e todos os anos, e todos os séculos. A eterna justiça soube o que fez: somou a eternidade com a ociosidade. As gerações legavam-me umas às outras. As línguas que morriam ficavam com o meu nome embutido na ossada. Com o volver dos tempos, esquecia-se tudo; os heróis dissipavam-se em mitos, na penumbra, ao longe; e a história ia caindo aos pedaços, não lhe ficando mais que duas ou três feições vagas e remotas. E eu via-as de um modo e de outro modo. Falaste em capítulo? Os que se foram, à nascença dos impérios, levaram a impressão da perpetuidade deles; os que expiraram quando eles decaíam, enterraram-se com a esperança da recomposição; mas sabes tu o que é ver as mesmas cousas, sem parar, a mesma alternativa de prosperidade e desolação, desolação e prosperidade, eternas exéquias e eternas aleluias, auroras sobre auroras, ocasos sobre ocasos? Prometeu. Mas não padeceste, creio; é alguma cousa não padecer nada. Ahasverus. Sim, mas vi padecer os outros homens, e para o fim o espetáculo da alegria dava-me a mesma sensação que os discursos de um doido. Fatalidades do sangue e da carne, conflitos sem fim, tudo vi passar a meus olhos, a ponto que a noite me fez perder o gosto ao dia, e acabo não distinguindo as flores das urzes. Tudo se me confunde na retina enfarada. Prometeu. Pessoalmente não te doeu nada; e eu que padeci por tempos inúmeros o efeito da cólera divina? Ahasverus. Tu? Prometeu. Prometeu é o meu nome. Ahasverus. Tu Prometeu? 3  Prometeu. E qual foi o meu crime? Fiz de lodo e água os primeiros homens, e depois, compadecido, roubei para eles o fogo do céu. Tal foi o meu crime. Júpiter, que então regia o Olimpo, condenou-me ao mais cruel suplício. Anda, sobe comigo a este rochedo. Ahasverus. Contas-me uma fábula. Conheço esse sonho helênico. Prometeu. Velho incrédulo! Anda ver as próprias correntes que me agrilhoaram; foi uma pena excessiva para nenhuma culpa; mas a divindade orgulhosa e terrível... Chegamos, olha, aqui estão elas... Ahasverus. O tempo que tudo rói não as quis então? Prometeu. Eram de mão divina; fabricou-as Vulcano. Dois emissários do céu vieram atar-me ao rochedo, e uma águia, como aquela que lá corta o horizonte, comia-me o fígado, sem consumi-lo nunca. Durou isto tempos que não contei. Não, não podes imaginar este suplício... Ahasverus. Não me iludes? Tu Prometeu? Não foi então um sonho da imaginação antiga? Prometeu. Olha bem para mim, palpa estas mãos. Vê se existo. Ahasverus. Moisés mentiu-me. Tu Prometeu, criador dos primeiros homens? Prometeu. Foi o meu crime. Ahasverus. Sim, foi o teu crime, artífice do inferno; foi o teu crime inexplicável. Aqui devias ter ficado por todos os tempos, agrilhoado e devorado, tu, origem dos males que me afligiram. Careci de piedade, é certo; mas tu, que me trouxeste à existência, divindade perversa, foste a causa original de tudo. Prometeu. A morte próxima obscurece-te a razão. Ahasverus. Sim, és tu mesmo, tens a fronte olímpica, forte e belo titã: és tu mesmo... São estas as cadeias? Não vejo o sinal das tuas lágrimas. Prometeu. Chorei-as pela tua raça. Ahasverus. Ela chorou muito mais por tua culpa. Prometeu. Ouve, último homem, último ingrato! Ahasverus. Para que quero eu palavras tuas? Quero os teus gemidos, divindade perversa.",
        "gender": "female",
        "pch_occurrences": {
            "testa": {
                "syns": [
                    "fronte",
                    "testas",
                    "frontes"
                ],
                "occurrences": [
                    "fronte"
                ],
                "occurrences_n": 1
            },
            "olho": {
                "syns": [
                    "olhos"
                ],
                "occurrences": [
                    "olhos",
                    "olhos",
                    "olho",
                    "olho"
                ],
                "occurrences_n": 4
            },
            "ombro": {
                "syns": [
                    "ombros"
                ],
                "occurrences": [
                    "ombros",
                    "ombro"
                ],
                "occurrences_n": 2
            },
            "mão": {
                "syns": [
                    "mãos"
                ],
                "occurrences": [
                    "mão",
                    "mão",
                    "mão",
                    "mãos"
                ],
                "occurrences_n": 4
            },
            "osso": {
                "syns": [
                    "ossos"
                ],
                "occurrences": [
                    "osso",
                    "osso",
                    "ossos",
                    "ossos"
                ],
                "occurrences_n": 4
            },
            "língua": {
                "syns": [
                    "línguas"
                ],
                "occurrences": [
                    "línguas",
                    "língua",
                    "língua"
                ],
                "occurrences_n": 3
            }
        },
        "dependencies": [
            {
                "head": "pena",
                "child": "divindade",
                "dep_h": "parataxis",
                "pos_h": "NOUN",
                "lemma_h": "pena",
                "dep_c": "conj",
                "pos_c": "NOUN",
                "lemma_c": "divindade",
                "categories": [],
                "pch_dependencies": []
            },
            {
                "head": "divindade",
                "child": "orgulhosa",
                "dep_h": "conj",
                "pos_h": "NOUN",
                "lemma_h": "divindade",
                "dep_c": "amod",
                "pos_c": "ADJ",
                "lemma_c": "orgulhoso",
                "categories": [
                    "carater_emo"
                ],
                "pch_dependencies": []
            },
            {
                "head": "divindade",
                "child": "pena",
                "dep_h": "conj",
                "pos_h": "NOUN",
                "lemma_h": "divindade",
                "dep_c": "parataxis",
                "pos_c": "NOUN",
                "lemma_c": "pena",
                "categories": [],
                "pch_dependencies": []
            },
            {
                "head": "existência",
                "child": ", divindade",
                "dep_h": "obj",
                "pos_h": "NOUN",
                "lemma_h": "existência",
                "dep_c": "appos",
                "pos_c": "NOUN",
                "lemma_c": "divindade",
                "categories": [],
                "pch_dependencies": []
            },
            {
                "head": ", divindade",
                "child": "perversa",
                "dep_h": "appos",
                "pos_h": "NOUN",
                "lemma_h": "divindade",
                "dep_c": "amod",
                "pos_c": "ADJ",
                "lemma_c": "perverso",
                "categories": [
                    "carater"
                ],
                "pch_dependencies": []
            },
            {
                "head": ", divindade",
                "child": "existência",
                "dep_h": "appos",
                "pos_h": "NOUN",
                "lemma_h": "divindade",
                "dep_c": "obj",
                "pos_c": "NOUN",
                "lemma_c": "existência",
                "categories": [],
                "pch_dependencies": []
            },
            {
                "head": ", divindade",
                "child": "mas tu",
                "dep_h": "appos",
                "pos_h": "NOUN",
                "lemma_h": "divindade",
                "dep_c": "ROOT",
                "pos_c": "PROPN",
                "lemma_c": "tu",
                "categories": [],
                "pch_dependencies": []
            },
            {
                "head": "os teus gemidos",
                "child": ", divindade",
                "dep_h": "nsubj",
                "pos_h": "NOUN",
                "lemma_h": "gemido",
                "dep_c": "conj",
                "pos_c": "NOUN",
                "lemma_c": "divindade",
                "categories": [],
                "pch_dependencies": []
            },
            {
                "head": ", divindade",
                "child": "perversa",
                "dep_h": "conj",
                "pos_h": "NOUN",
                "lemma_h": "divindade",
                "dep_c": "amod",
                "pos_c": "ADJ",
                "lemma_c": "perverso",
                "categories": [
                    "carater"
                ],
                "pch_dependencies": []
            },
            {
                "head": ", divindade",
                "child": "os teus gemidos",
                "dep_h": "conj",
                "pos_h": "NOUN",
                "lemma_h": "divindade",
                "dep_c": "nsubj",
                "pos_c": "NOUN",
                "lemma_c": "gemido",
                "categories": [],
                "pch_dependencies": []
            }
        ]
    },
    {
        "class": "PESSOA",
        "entity": "Hércules",
        "sentence": "Prometeu.  Hércules.",
        "start_char": 8613,
        "end_char": 8621,
        "excerpt": "Vê como as levanto nas mãos; ouve o tinir dos ferros... Quem te desagrilhoou outrora? Prometeu.  Hércules.",
        "gender": "male",
        "pch_occurrences": {
            "mão": {
                "syns": [
                    "mãos"
                ],
                "occurrences": [
                    "mão",
                    "mãos"
                ],
                "occurrences_n": 2
            }
        },
        "dependencies": []
    },
    {
        "class": "PESSOA",
        "entity": "asverus",
        "sentence": "Ahasverus.",
        "start_char": 396,
        "end_char": 403,
        "excerpt": "Medita, depois sonha. Vai declinando o dia. Ahasverus.",
        "gender": "male",
        "pch_occurrences": null,
        "dependencies": []
    },
    {
        "class": "PESSOA",
        "entity": "Hércules",
        "sentence": "Hércules...",
        "start_char": 8634,
        "end_char": 8642,
        "excerpt": "Prometeu.  Hércules. Ahasverus. Hércules...",
        "gender": "male",
        "pch_occurrences": null,
        "dependencies": []
    },
    {
        "class": "PESSOA",
        "entity": "asverus",
        "sentence": "Ahasverus.",
        "start_char": 396,
        "end_char": 403,
        "excerpt": "Medita, depois sonha. Vai declinando o dia. Ahasverus.",
        "gender": "male",
        "pch_occurrences": null,
        "dependencies": []
    },
    {
        "class": "PESSOA",
        "entity": "Hércules",
        "sentence": "Nem Hércules poderá mais romper estes ferros.",
        "start_char": 8839,
        "end_char": 8847,
        "excerpt": "Ahasverus. Chego à cláusula dos tempos; este é o limiar da eternidade. A terra está deserta; nenhum outro homem respira o ar da vida. Sou o último; posso morrer. Morrer! Deliciosa idéia! Séculos de séculos vivi, cansado, mortificado, andando sempre, mas ei-los que acabam e vou morrer com eles. Velha natureza, adeus! Céu azul, imenso céu for aberto para que desçam os espíritos da vida nova, terra inimiga, que me não comeste os ossos, adeus! O errante não errará mais. Deus me perdoará, se quiser, mas a morte consola-me. Aquela montanha é áspera como a minha dor; aquelas águias, que ali passam, devem ser famintas como o meu desespero. Morrereis também, águias divinas? Prometeu. Certo que os homens acabaram; a terra está nua deles. Ahasverus. Ouço ainda uma voz... Voz de homem? Céus implacáveis, não sou então o último? Ei-lo que se aproxima... Quem és tu? Há em teus grandes olhos alguma cousa parecida com a luz misteriosa dos arcanjos de Israel; não és homem... Prometeu. Não. Ahasverus. Raça divina? Prometeu. Tu o disseste. Ahasverus. Não te conheço; mas que importa que te não conheça? Não és homem; posso então morrer; pois sou o último, e fecho a porta da vida. Prometeu. A vida, como a antiga Tebas, tem cem portas. Fechas uma, outras se abrirão. És o último da tua espécie? Virá outra espécie melhor, não feita do mesmo barro, mas da mesma luz. Sim, homem derradeiro, toda a plebe dos espíritos perecerá para sempre; a flor deles é que voltará à terra para reger as coisas. Os tempos serão retificados. O mal acabará; os ventos não espalharão mais nem os germes da morte, nem o clamor dos oprimidos, mas tão somente a cantiga do amor perene e a bênção da universal justiça... Ahasverus. Que importa à espécie que vai morrer comigo toda essa delícia póstuma? Crê-me, tu que és imortal, para os ossos que apodrecem na terra as púrpuras de Sidônia não valem nada. O que tu me contas é ainda melhor que o sonho de Campanella. Na cidade deste havia delitos e enfermidades; a tua exclui todas as lesões morais e físicas. O Senhor te ouça! Mas deixa-me ir morrer. Prometeu. Vai, vai. Que pressa tens em acabar os teus dias? Ahasverus. A pressa de um homem que tem vivido milheiros de anos. Sim, milheiros de anos. Homens que apenas respiraram por dezenas deles, inventaram um sentimento de enfado, tedium vitae, que eles nunca puderam conhecer, ao menos em toda a sua implacável e vasta realidade, porque é preciso haver calcado, como eu, todas as gerações e todas as ruínas, para experimentar esse profundo fastio da existência. Prometeu. Milheiros de anos? Ahasverus. Meu nome é Ahasverus: vivia em Jerusalém, ao tempo em que iam crucificar Jesus Cristo. Quando ele passou pela minha porta, afrouxou ao peso do madeiro que levava aos ombros, e eu empurrei-o, bradando-lhe que não parasse, 2  que não descansasse, que fosse andando até à colina, onde tinha de ser crucificado... Então uma voz anunciou-me do céu que eu andaria sempre, continuamente, até o fim dos tempos. Tal é a minha culpa; não tive piedade para com aquele que ia morrer. Não sei mesmo como isto foi. Os fariseus diziam que o filho de Maria vinha destruir a lei, e que era preciso matá-lo; eu, pobre ignorante, quis realçar o meu zelo e daí a ação daquele dia. Que de vezes vi isto mesmo, depois, atravessando os tempos e as cidades! Onde quer que o zelo penetrou numa alma subalterna, fez-se cruel ou ridículo. Foi a minha culpa irremissível. Prometeu. Grave culpa, em verdade, mas a pena foi benévola. Os outros homens leram da vida um capítulo, tu leste o livro inteiro. Que sabe um capítulo de outro capítulo? Nada; mas o que os leu a todos, liga-os e conclui. Há páginas melancólicas? Há outras joviais e felizes. À convulsão trágica precede a do riso, a vida brota da morte, cegonhas e andorinhas trocam de clima, sem jamais abandoná- lo inteiramente; é assim que tudo se concerta e restitui. Tu viste isso, não dez vezes, não mil vezes, mas todas as vezes; viste a magnificência da terra curando a aflição da alma, e a alegria da alma suprindo à desolação das cousas; dança alternada da natureza, que dá a mão esquerda a Jó e a direita a Sardanapalo. Ahasverus. Que sabes tu da minha vida? Nada; ignoras a vida humana. Prometeu. Ignoro a vida humana? Deixa-me rir! Eia, homem perpétuo, explica-te. Conta-me tudo; saíste de Jerusalém... Ahasverus. Saí de Jerusalém. Comecei a peregrinação dos tempos. Ia a toda parte, qualquer que fosse a raça, o culto ou a língua; sóis e neves, povos bárbaros e cultos, ilhas, continentes, onde quer que respirasse um homem aí respirei eu. Nunca mais trabalhei. Trabalho é refúgio, e não tive esse refúgio. Cada manhã achava comigo a moeda do dia... Vede; cá está a última. Ide, que já não sois precisa (atira a moeda ao longe). Não trabalhava, andava apenas, sempre, sempre, sempre, um dia e outro dia, um ano e outro ano, e todos os anos, e todos os séculos. A eterna justiça soube o que fez: somou a eternidade com a ociosidade. As gerações legavam-me umas às outras. As línguas que morriam ficavam com o meu nome embutido na ossada. Com o volver dos tempos, esquecia-se tudo; os heróis dissipavam-se em mitos, na penumbra, ao longe; e a história ia caindo aos pedaços, não lhe ficando mais que duas ou três feições vagas e remotas. E eu via-as de um modo e de outro modo. Falaste em capítulo? Os que se foram, à nascença dos impérios, levaram a impressão da perpetuidade deles; os que expiraram quando eles decaíam, enterraram-se com a esperança da recomposição; mas sabes tu o que é ver as mesmas cousas, sem parar, a mesma alternativa de prosperidade e desolação, desolação e prosperidade, eternas exéquias e eternas aleluias, auroras sobre auroras, ocasos sobre ocasos? Prometeu. Mas não padeceste, creio; é alguma cousa não padecer nada. Ahasverus. Sim, mas vi padecer os outros homens, e para o fim o espetáculo da alegria dava-me a mesma sensação que os discursos de um doido. Fatalidades do sangue e da carne, conflitos sem fim, tudo vi passar a meus olhos, a ponto que a noite me fez perder o gosto ao dia, e acabo não distinguindo as flores das urzes. Tudo se me confunde na retina enfarada. Prometeu. Pessoalmente não te doeu nada; e eu que padeci por tempos inúmeros o efeito da cólera divina? Ahasverus. Tu? Prometeu. Prometeu é o meu nome. Ahasverus. Tu Prometeu? 3  Prometeu. E qual foi o meu crime? Fiz de lodo e água os primeiros homens, e depois, compadecido, roubei para eles o fogo do céu. Tal foi o meu crime. Júpiter, que então regia o Olimpo, condenou-me ao mais cruel suplício. Anda, sobe comigo a este rochedo. Ahasverus. Contas-me uma fábula. Conheço esse sonho helênico. Prometeu. Velho incrédulo! Anda ver as próprias correntes que me agrilhoaram; foi uma pena excessiva para nenhuma culpa; mas a divindade orgulhosa e terrível... Chegamos, olha, aqui estão elas... Ahasverus. O tempo que tudo rói não as quis então? Prometeu. Eram de mão divina; fabricou-as Vulcano. Dois emissários do céu vieram atar-me ao rochedo, e uma águia, como aquela que lá corta o horizonte, comia-me o fígado, sem consumi-lo nunca. Durou isto tempos que não contei. Não, não podes imaginar este suplício... Ahasverus. Não me iludes? Tu Prometeu? Não foi então um sonho da imaginação antiga? Prometeu. Olha bem para mim, palpa estas mãos. Vê se existo. Ahasverus. Moisés mentiu-me. Tu Prometeu, criador dos primeiros homens? Prometeu. Foi o meu crime. Ahasverus. Sim, foi o teu crime, artífice do inferno; foi o teu crime inexplicável. Aqui devias ter ficado por todos os tempos, agrilhoado e devorado, tu, origem dos males que me afligiram. Careci de piedade, é certo; mas tu, que me trouxeste à existência, divindade perversa, foste a causa original de tudo. Prometeu. A morte próxima obscurece-te a razão. Ahasverus. Sim, és tu mesmo, tens a fronte olímpica, forte e belo titã: és tu mesmo... São estas as cadeias? Não vejo o sinal das tuas lágrimas. Prometeu. Chorei-as pela tua raça. Ahasverus. Ela chorou muito mais por tua culpa. Prometeu. Ouve, último homem, último ingrato! Ahasverus. Para que quero eu palavras tuas? Quero os teus gemidos, divindade perversa. Aqui estão as cadeias. Vê como as levanto nas mãos; ouve o tinir dos ferros... Quem te desagrilhoou outrora? Prometeu.  Hércules. Ahasverus. Hércules... Vê se ele te presta igual serviço, agora que vais ser novamente agrilhoado. Prometeu.  Deliras. Ahasverus. O céu deu-te o primeiro castigo; agora a terra vai dar-te o segundo e derradeiro. Nem Hércules poderá mais romper estes ferros.",
        "gender": "male",
        "pch_occurrences": {
            "testa": {
                "syns": [
                    "fronte",
                    "testas",
                    "frontes"
                ],
                "occurrences": [
                    "fronte"
                ],
                "occurrences_n": 1
            },
            "olho": {
                "syns": [
                    "olhos"
                ],
                "occurrences": [
                    "olhos",
                    "olhos",
                    "olho",
                    "olho"
                ],
                "occurrences_n": 4
            },
            "ombro": {
                "syns": [
                    "ombros"
                ],
                "occurrences": [
                    "ombros",
                    "ombro"
                ],
                "occurrences_n": 2
            },
            "mão": {
                "syns": [
                    "mãos"
                ],
                "occurrences": [
                    "mão",
                    "mão",
                    "mão",
                    "mão",
                    "mãos",
                    "mãos"
                ],
                "occurrences_n": 6
            },
            "osso": {
                "syns": [
                    "ossos"
                ],
                "occurrences": [
                    "osso",
                    "osso",
                    "ossos",
                    "ossos"
                ],
                "occurrences_n": 4
            },
            "língua": {
                "syns": [
                    "línguas"
                ],
                "occurrences": [
                    "línguas",
                    "língua",
                    "língua"
                ],
                "occurrences_n": 3
            }
        },
        "dependencies": [
            {
                "head": "poderá",
                "child": "Nem Hércules",
                "dep_h": "ROOT",
                "pos_h": "VERB",
                "lemma_h": "poder",
                "dep_c": "nsubj",
                "pos_c": "PROPN",
                "lemma_c": "Hércules",
                "categories": [],
                "pch_dependencies": []
            }
        ]
    },
    {
        "class": "PESSOA",
        "entity": "a águia",
        "sentence": "Chamarei a águia, e ela virá;",
        "start_char": 9095,
        "end_char": 9102,
        "excerpt": "Toda a humanidade está em mim. Antes de cair no abismo, escreverei nesta pedra o epitáfio de um mundo. Chamarei a águia, e ela virá;",
        "gender": "female",
        "pch_occurrences": null,
        "dependencies": [
            {
                "head": "Chamarei",
                "child": "a águia",
                "dep_h": "ROOT",
                "pos_h": "VERB",
                "lemma_h": "Chamarei",
                "dep_c": "obj",
                "pos_c": "NOUN",
                "lemma_c": "águia",
                "categories": [],
                "pch_dependencies": []
            }
        ]
    },
    {
        "class": "PESSOA",
        "entity": "o derradeiro homem",
        "sentence": "dir-lhe-ei que o derradeiro homem, ao partir da vida, deixa-lhe um regalo de deuses.",
        "start_char": 9131,
        "end_char": 9149,
        "excerpt": "Antes de cair no abismo, escreverei nesta pedra o epitáfio de um mundo. Chamarei a águia, e ela virá; dir-lhe-ei que o derradeiro homem, ao partir da vida, deixa-lhe um regalo de deuses.",
        "gender": "male",
        "pch_occurrences": null,
        "dependencies": [
            {
                "head": "vida",
                "child": "que o derradeiro homem",
                "dep_h": "nmod",
                "pos_h": "NOUN",
                "lemma_h": "vida",
                "dep_c": "nmod",
                "pos_c": "NOUN",
                "lemma_c": "homem",
                "categories": [
                    "outro"
                ],
                "pch_dependencies": []
            }
        ]
    },
    {
        "class": "PESSOA",
        "entity": "ignorante",
        "sentence": "Pobre ignorante, que rejeitas um trono!",
        "start_char": 9217,
        "end_char": 9226,
        "excerpt": "dir-lhe-ei que o derradeiro homem, ao partir da vida, deixa-lhe um regalo de deuses. Prometeu. Pobre ignorante, que rejeitas um trono!",
        "gender": "male",
        "pch_occurrences": null,
        "dependencies": [
            {
                "head": "Pobre",
                "child": "ignorante",
                "dep_h": "ROOT",
                "pos_h": "NOUN",
                "lemma_h": "pobre",
                "dep_c": "amod",
                "pos_c": "ADJ",
                "lemma_c": "ignorante",
                "categories": [
                    "social",
                    "carater"
                ],
                "pch_dependencies": []
            }
        ]
    },
    {
        "class": "PESSOA",
        "entity": "asverus",
        "sentence": "Ahasverus.",
        "start_char": 396,
        "end_char": 403,
        "excerpt": "Medita, depois sonha. Vai declinando o dia. Ahasverus.",
        "gender": "male",
        "pch_occurrences": null,
        "dependencies": []
    },
    {
        "class": "PESSOA",
        "entity": "Prometeu",
        "sentence": "Agora as pernas... Prometeu.",
        "start_char": 9435,
        "end_char": 9443,
        "excerpt": "Eia, prostra-te, deixa-me ligar-te os braços. Assim, bem, não resistirás mais; arqueja para aí. Agora as pernas... Prometeu.",
        "gender": "male",
        "pch_occurrences": {
            "braço": {
                "syns": [
                    "braços"
                ],
                "occurrences": [
                    "braço",
                    "braços"
                ],
                "occurrences_n": 2
            },
            "perna": {
                "syns": [
                    "pernas"
                ],
                "occurrences": [
                    "pernas",
                    "perna"
                ],
                "occurrences_n": 2
            }
        },
        "dependencies": []
    },
    {
        "class": "PESSOA",
        "entity": "Hércules",
        "sentence": "Tu mesmo serás o novo Hércules.",
        "start_char": 9650,
        "end_char": 9658,
        "excerpt": "São as paixões da terra que se voltam contra mim; mas eu, que não sou homem, não conheço a ingratidão. Não arrancarás uma letra ao teu destino, ele se cumprirá inteiro. Tu mesmo serás o novo Hércules.",
        "gender": "male",
        "pch_occurrences": null,
        "dependencies": [
            {
                "head": "Tu",
                "child": "o novo Hércules",
                "dep_h": "ROOT",
                "pos_h": "PROPN",
                "lemma_h": "Tu",
                "dep_c": "nsubj",
                "pos_c": "PROPN",
                "lemma_c": "Hércules",
                "categories": [],
                "pch_dependencies": []
            },
            {
                "head": "o novo Hércules",
                "child": "Tu",
                "dep_h": "nsubj",
                "pos_h": "PROPN",
                "lemma_h": "Hércules",
                "dep_c": "ROOT",
                "pos_c": "PROPN",
                "lemma_c": "Tu",
                "categories": [],
                "pch_dependencies": []
            }
        ]
    },
    {
        "class": "PESSOA",
        "entity": "asverus",
        "sentence": "Ahasverus.",
        "start_char": 396,
        "end_char": 403,
        "excerpt": "Medita, depois sonha. Vai declinando o dia. Ahasverus.",
        "gender": "male",
        "pch_occurrences": null,
        "dependencies": []
    },
    {
        "class": "PESSOA",
        "entity": "aos homens",
        "sentence": "A verdade ignota aos homens",
        "start_char": 9800,
        "end_char": 9810,
        "excerpt": "Deliras tu? 4  Prometeu. A verdade ignota aos homens",
        "gender": "unknown",
        "pch_occurrences": null,
        "dependencies": []
    },
    {
        "class": "PESSOA",
        "entity": "asverus",
        "sentence": "Ahasverus.",
        "start_char": 396,
        "end_char": 403,
        "excerpt": "Medita, depois sonha. Vai declinando o dia. Ahasverus.",
        "gender": "male",
        "pch_occurrences": null,
        "dependencies": []
    },
    {
        "class": "PESSOA",
        "entity": "águia",
        "sentence": "Acaba, acaba; ensina ao bico adunco da águia como me há de devorar a entranha; mas escuta...",
        "start_char": 9978,
        "end_char": 9983,
        "excerpt": "Prometeu. Certo que os homens acabaram; a terra está nua deles. Ahasverus. Ouço ainda uma voz... Voz de homem? Céus implacáveis, não sou então o último? Ei-lo que se aproxima... Quem és tu? Há em teus grandes olhos alguma cousa parecida com a luz misteriosa dos arcanjos de Israel; não és homem... Prometeu. Não. Ahasverus. Raça divina? Prometeu. Tu o disseste. Ahasverus. Não te conheço; mas que importa que te não conheça? Não és homem; posso então morrer; pois sou o último, e fecho a porta da vida. Prometeu. A vida, como a antiga Tebas, tem cem portas. Fechas uma, outras se abrirão. És o último da tua espécie? Virá outra espécie melhor, não feita do mesmo barro, mas da mesma luz. Sim, homem derradeiro, toda a plebe dos espíritos perecerá para sempre; a flor deles é que voltará à terra para reger as coisas. Os tempos serão retificados. O mal acabará; os ventos não espalharão mais nem os germes da morte, nem o clamor dos oprimidos, mas tão somente a cantiga do amor perene e a bênção da universal justiça... Ahasverus. Que importa à espécie que vai morrer comigo toda essa delícia póstuma? Crê-me, tu que és imortal, para os ossos que apodrecem na terra as púrpuras de Sidônia não valem nada. O que tu me contas é ainda melhor que o sonho de Campanella. Na cidade deste havia delitos e enfermidades; a tua exclui todas as lesões morais e físicas. O Senhor te ouça! Mas deixa-me ir morrer. Prometeu. Vai, vai. Que pressa tens em acabar os teus dias? Ahasverus. A pressa de um homem que tem vivido milheiros de anos. Sim, milheiros de anos. Homens que apenas respiraram por dezenas deles, inventaram um sentimento de enfado, tedium vitae, que eles nunca puderam conhecer, ao menos em toda a sua implacável e vasta realidade, porque é preciso haver calcado, como eu, todas as gerações e todas as ruínas, para experimentar esse profundo fastio da existência. Prometeu. Milheiros de anos? Ahasverus. Meu nome é Ahasverus: vivia em Jerusalém, ao tempo em que iam crucificar Jesus Cristo. Quando ele passou pela minha porta, afrouxou ao peso do madeiro que levava aos ombros, e eu empurrei-o, bradando-lhe que não parasse, 2  que não descansasse, que fosse andando até à colina, onde tinha de ser crucificado... Então uma voz anunciou-me do céu que eu andaria sempre, continuamente, até o fim dos tempos. Tal é a minha culpa; não tive piedade para com aquele que ia morrer. Não sei mesmo como isto foi. Os fariseus diziam que o filho de Maria vinha destruir a lei, e que era preciso matá-lo; eu, pobre ignorante, quis realçar o meu zelo e daí a ação daquele dia. Que de vezes vi isto mesmo, depois, atravessando os tempos e as cidades! Onde quer que o zelo penetrou numa alma subalterna, fez-se cruel ou ridículo. Foi a minha culpa irremissível. Prometeu. Grave culpa, em verdade, mas a pena foi benévola. Os outros homens leram da vida um capítulo, tu leste o livro inteiro. Que sabe um capítulo de outro capítulo? Nada; mas o que os leu a todos, liga-os e conclui. Há páginas melancólicas? Há outras joviais e felizes. À convulsão trágica precede a do riso, a vida brota da morte, cegonhas e andorinhas trocam de clima, sem jamais abandoná- lo inteiramente; é assim que tudo se concerta e restitui. Tu viste isso, não dez vezes, não mil vezes, mas todas as vezes; viste a magnificência da terra curando a aflição da alma, e a alegria da alma suprindo à desolação das cousas; dança alternada da natureza, que dá a mão esquerda a Jó e a direita a Sardanapalo. Ahasverus. Que sabes tu da minha vida? Nada; ignoras a vida humana. Prometeu. Ignoro a vida humana? Deixa-me rir! Eia, homem perpétuo, explica-te. Conta-me tudo; saíste de Jerusalém... Ahasverus. Saí de Jerusalém. Comecei a peregrinação dos tempos. Ia a toda parte, qualquer que fosse a raça, o culto ou a língua; sóis e neves, povos bárbaros e cultos, ilhas, continentes, onde quer que respirasse um homem aí respirei eu. Nunca mais trabalhei. Trabalho é refúgio, e não tive esse refúgio. Cada manhã achava comigo a moeda do dia... Vede; cá está a última. Ide, que já não sois precisa (atira a moeda ao longe). Não trabalhava, andava apenas, sempre, sempre, sempre, um dia e outro dia, um ano e outro ano, e todos os anos, e todos os séculos. A eterna justiça soube o que fez: somou a eternidade com a ociosidade. As gerações legavam-me umas às outras. As línguas que morriam ficavam com o meu nome embutido na ossada. Com o volver dos tempos, esquecia-se tudo; os heróis dissipavam-se em mitos, na penumbra, ao longe; e a história ia caindo aos pedaços, não lhe ficando mais que duas ou três feições vagas e remotas. E eu via-as de um modo e de outro modo. Falaste em capítulo? Os que se foram, à nascença dos impérios, levaram a impressão da perpetuidade deles; os que expiraram quando eles decaíam, enterraram-se com a esperança da recomposição; mas sabes tu o que é ver as mesmas cousas, sem parar, a mesma alternativa de prosperidade e desolação, desolação e prosperidade, eternas exéquias e eternas aleluias, auroras sobre auroras, ocasos sobre ocasos? Prometeu. Mas não padeceste, creio; é alguma cousa não padecer nada. Ahasverus. Sim, mas vi padecer os outros homens, e para o fim o espetáculo da alegria dava-me a mesma sensação que os discursos de um doido. Fatalidades do sangue e da carne, conflitos sem fim, tudo vi passar a meus olhos, a ponto que a noite me fez perder o gosto ao dia, e acabo não distinguindo as flores das urzes. Tudo se me confunde na retina enfarada. Prometeu. Pessoalmente não te doeu nada; e eu que padeci por tempos inúmeros o efeito da cólera divina? Ahasverus. Tu? Prometeu. Prometeu é o meu nome. Ahasverus. Tu Prometeu? 3  Prometeu. E qual foi o meu crime? Fiz de lodo e água os primeiros homens, e depois, compadecido, roubei para eles o fogo do céu. Tal foi o meu crime. Júpiter, que então regia o Olimpo, condenou-me ao mais cruel suplício. Anda, sobe comigo a este rochedo. Ahasverus. Contas-me uma fábula. Conheço esse sonho helênico. Prometeu. Velho incrédulo! Anda ver as próprias correntes que me agrilhoaram; foi uma pena excessiva para nenhuma culpa; mas a divindade orgulhosa e terrível... Chegamos, olha, aqui estão elas... Ahasverus. O tempo que tudo rói não as quis então? Prometeu. Eram de mão divina; fabricou-as Vulcano. Dois emissários do céu vieram atar-me ao rochedo, e uma águia, como aquela que lá corta o horizonte, comia-me o fígado, sem consumi-lo nunca. Durou isto tempos que não contei. Não, não podes imaginar este suplício... Ahasverus. Não me iludes? Tu Prometeu? Não foi então um sonho da imaginação antiga? Prometeu. Olha bem para mim, palpa estas mãos. Vê se existo. Ahasverus. Moisés mentiu-me. Tu Prometeu, criador dos primeiros homens? Prometeu. Foi o meu crime. Ahasverus. Sim, foi o teu crime, artífice do inferno; foi o teu crime inexplicável. Aqui devias ter ficado por todos os tempos, agrilhoado e devorado, tu, origem dos males que me afligiram. Careci de piedade, é certo; mas tu, que me trouxeste à existência, divindade perversa, foste a causa original de tudo. Prometeu. A morte próxima obscurece-te a razão. Ahasverus. Sim, és tu mesmo, tens a fronte olímpica, forte e belo titã: és tu mesmo... São estas as cadeias? Não vejo o sinal das tuas lágrimas. Prometeu. Chorei-as pela tua raça. Ahasverus. Ela chorou muito mais por tua culpa. Prometeu. Ouve, último homem, último ingrato! Ahasverus. Para que quero eu palavras tuas? Quero os teus gemidos, divindade perversa. Aqui estão as cadeias. Vê como as levanto nas mãos; ouve o tinir dos ferros... Quem te desagrilhoou outrora? Prometeu.  Hércules. Ahasverus. Hércules... Vê se ele te presta igual serviço, agora que vais ser novamente agrilhoado. Prometeu.  Deliras. Ahasverus. O céu deu-te o primeiro castigo; agora a terra vai dar-te o segundo e derradeiro. Nem Hércules poderá mais romper estes ferros. Olha como os agito no ar, à maneira de plumas; é que eu represento a força dos desesperos milenários. Toda a humanidade está em mim. Antes de cair no abismo, escreverei nesta pedra o epitáfio de um mundo. Chamarei a águia, e ela virá; dir-lhe-ei que o derradeiro homem, ao partir da vida, deixa-lhe um regalo de deuses. Prometeu. Pobre ignorante, que rejeitas um trono! Não, não podes mesmo rejeitá-lo. Ahasverus. És tu agora que deliras. Eia, prostra-te, deixa-me ligar-te os braços. Assim, bem, não resistirás mais; arqueja para aí. Agora as pernas... Prometeu. Acaba, acaba. São as paixões da terra que se voltam contra mim; mas eu, que não sou homem, não conheço a ingratidão. Não arrancarás uma letra ao teu destino, ele se cumprirá inteiro. Tu mesmo serás o novo Hércules. Eu, que anunciei a glória do outro, anuncio a tua; e não serás menos generoso que ele. Ahasverus. Deliras tu? 4  Prometeu. A verdade ignota aos homens é o delírio de quem a anuncia. Anda, acaba. Ahasverus. A glória não paga nada, e extingue-se. Prometeu. Esta não se extinguirá. Acaba, acaba; ensina ao bico adunco da águia como me há de devorar a entranha; mas escuta...",
        "gender": "female",
        "pch_occurrences": {
            "testa": {
                "syns": [
                    "fronte",
                    "testas",
                    "frontes"
                ],
                "occurrences": [
                    "fronte"
                ],
                "occurrences_n": 1
            },
            "olho": {
                "syns": [
                    "olhos"
                ],
                "occurrences": [
                    "olhos",
                    "olhos",
                    "olho",
                    "olho"
                ],
                "occurrences_n": 4
            },
            "ombro": {
                "syns": [
                    "ombros"
                ],
                "occurrences": [
                    "ombros",
                    "ombro"
                ],
                "occurrences_n": 2
            },
            "braço": {
                "syns": [
                    "braços"
                ],
                "occurrences": [
                    "braço",
                    "braços"
                ],
                "occurrences_n": 2
            },
            "mão": {
                "syns": [
                    "mãos"
                ],
                "occurrences": [
                    "mão",
                    "mão",
                    "mão",
                    "mão",
                    "mãos",
                    "mãos"
                ],
                "occurrences_n": 6
            },
            "perna": {
                "syns": [
                    "pernas"
                ],
                "occurrences": [
                    "pernas",
                    "perna"
                ],
                "occurrences_n": 2
            },
            "osso": {
                "syns": [
                    "ossos"
                ],
                "occurrences": [
                    "osso",
                    "ossos"
                ],
                "occurrences_n": 2
            },
            "língua": {
                "syns": [
                    "línguas"
                ],
                "occurrences": [
                    "línguas",
                    "língua",
                    "língua"
                ],
                "occurrences_n": 3
            }
        },
        "dependencies": [
            {
                "head": "vieram",
                "child": "águia",
                "dep_h": "ccomp",
                "pos_h": "VERB",
                "lemma_h": "vir",
                "dep_c": "conj",
                "pos_c": "NOUN",
                "lemma_c": "águia",
                "categories": [],
                "pch_dependencies": []
            },
            {
                "head": "o horizonte",
                "child": "águia",
                "dep_h": "obj",
                "pos_h": "NOUN",
                "lemma_h": "horizonte",
                "dep_c": "conj",
                "pos_c": "NOUN",
                "lemma_c": "águia",
                "categories": [],
                "pch_dependencies": []
            },
            {
                "head": "Chamarei",
                "child": "a águia",
                "dep_h": "ROOT",
                "pos_h": "VERB",
                "lemma_h": "Chamarei",
                "dep_c": "obj",
                "pos_c": "NOUN",
                "lemma_c": "águia",
                "categories": [],
                "pch_dependencies": []
            },
            {
                "head": "ensina ao bico adunco",
                "child": "águia",
                "dep_h": "ROOT",
                "pos_h": "NOUN",
                "lemma_h": "adunco",
                "dep_c": "nmod",
                "pos_c": "NOUN",
                "lemma_c": "águia",
                "categories": [],
                "pch_dependencies": []
            },
            {
                "head": "águia",
                "child": "ensina ao bico adunco",
                "dep_h": "nmod",
                "pos_h": "NOUN",
                "lemma_h": "águia",
                "dep_c": "ROOT",
                "pos_c": "NOUN",
                "lemma_c": "adunco",
                "categories": [],
                "pch_dependencies": []
            }
        ]
    },
    {
        "class": "PESSOA",
        "entity": "asverus",
        "sentence": "Ahasverus.",
        "start_char": 396,
        "end_char": 403,
        "excerpt": "Medita, depois sonha. Vai declinando o dia. Ahasverus.",
        "gender": "male",
        "pch_occurrences": null,
        "dependencies": []
    },
    {
        "class": "PESSOA",
        "entity": "O mundo passageiro",
        "sentence": "O mundo passageiro não pode entender o mundo eterno; mas tu serás o elo entre ambos.",
        "start_char": 10111,
        "end_char": 10129,
        "excerpt": "Fala, fala. Prometeu. O mundo passageiro não pode entender o mundo eterno; mas tu serás o elo entre ambos.",
        "gender": "unknown",
        "pch_occurrences": null,
        "dependencies": []
    },
    {
        "class": "PESSOA",
        "entity": "asverus",
        "sentence": "Ahasverus.",
        "start_char": 396,
        "end_char": 403,
        "excerpt": "Medita, depois sonha. Vai declinando o dia. Ahasverus.",
        "gender": "male",
        "pch_occurrences": null,
        "dependencies": []
    },
    {
        "class": "PESSOA",
        "entity": "divino",
        "sentence": "Nobre família, lúcida e poderosa, será perfeita comunhão do divino com o humano.",
        "start_char": 10535,
        "end_char": 10541,
        "excerpt": "Que te diga tudo? Já te disse que uma raça nova povoará a terra, feita dos melhores espíritos da raça extinta; a multidão dos outros perecerá. Nobre família, lúcida e poderosa, será perfeita comunhão do divino com o humano.",
        "gender": "male",
        "pch_occurrences": null,
        "dependencies": [
            {
                "head": "perfeita",
                "child": "divino",
                "dep_h": "parataxis",
                "pos_h": "VERB",
                "lemma_h": "perfeito",
                "dep_c": "nmod",
                "pos_c": "NOUN",
                "lemma_c": "divino",
                "categories": [
                    "aparencia_carater",
                    "aparencia_carater_social"
                ],
                "pch_dependencies": []
            }
        ]
    },
    {
        "class": "PESSOA",
        "entity": "asverus",
        "sentence": "Ahasverus.",
        "start_char": 396,
        "end_char": 403,
        "excerpt": "Medita, depois sonha. Vai declinando o dia. Ahasverus.",
        "gender": "male",
        "pch_occurrences": null,
        "dependencies": []
    },
    {
        "class": "PESSOA",
        "entity": "rei",
        "sentence": "Tu mesmo, tu eleito, tu, rei.",
        "start_char": 10689,
        "end_char": 10692,
        "excerpt": "Eu? Prometeu. Tu mesmo, tu eleito, tu, rei.",
        "gender": "male",
        "pch_occurrences": null,
        "dependencies": [
            {
                "head": "tu",
                "child": ", rei",
                "dep_h": "parataxis",
                "pos_h": "PROPN",
                "lemma_h": "tu",
                "dep_c": "appos",
                "pos_c": "NOUN",
                "lemma_c": "rei",
                "categories": [
                    "social"
                ],
                "pch_dependencies": []
            },
            {
                "head": ", rei",
                "child": "tu",
                "dep_h": "appos",
                "pos_h": "NOUN",
                "lemma_h": "rei",
                "dep_c": "parataxis",
                "pos_c": "PROPN",
                "lemma_c": "tu",
                "categories": [
                    "social"
                ],
                "pch_dependencies": []
            },
            {
                "head": ", rei",
                "child": "Tu",
                "dep_h": "appos",
                "pos_h": "NOUN",
                "lemma_h": "rei",
                "dep_c": "ROOT",
                "pos_c": "PROPN",
                "lemma_c": "Tu",
                "categories": [
                    "social"
                ],
                "pch_dependencies": []
            }
        ]
    },
    {
        "class": "PESSOA",
        "entity": "Ahasverus",
        "sentence": "Sim, Ahasverus, tu serás rei.",
        "start_char": 10699,
        "end_char": 10708,
        "excerpt": "Prometeu. Certo que os homens acabaram; a terra está nua deles. Ahasverus. Ouço ainda uma voz... Voz de homem? Céus implacáveis, não sou então o último? Ei-lo que se aproxima... Quem és tu? Há em teus grandes olhos alguma cousa parecida com a luz misteriosa dos arcanjos de Israel; não és homem... Prometeu. Não. Ahasverus. Raça divina? Prometeu. Tu o disseste. Ahasverus. Não te conheço; mas que importa que te não conheça? Não és homem; posso então morrer; pois sou o último, e fecho a porta da vida. Prometeu. A vida, como a antiga Tebas, tem cem portas. Fechas uma, outras se abrirão. És o último da tua espécie? Virá outra espécie melhor, não feita do mesmo barro, mas da mesma luz. Sim, homem derradeiro, toda a plebe dos espíritos perecerá para sempre; a flor deles é que voltará à terra para reger as coisas. Os tempos serão retificados. O mal acabará; os ventos não espalharão mais nem os germes da morte, nem o clamor dos oprimidos, mas tão somente a cantiga do amor perene e a bênção da universal justiça... Ahasverus. Que importa à espécie que vai morrer comigo toda essa delícia póstuma? Crê-me, tu que és imortal, para os ossos que apodrecem na terra as púrpuras de Sidônia não valem nada. O que tu me contas é ainda melhor que o sonho de Campanella. Na cidade deste havia delitos e enfermidades; a tua exclui todas as lesões morais e físicas. O Senhor te ouça! Mas deixa-me ir morrer. Prometeu. Vai, vai. Que pressa tens em acabar os teus dias? Ahasverus. A pressa de um homem que tem vivido milheiros de anos. Sim, milheiros de anos. Homens que apenas respiraram por dezenas deles, inventaram um sentimento de enfado, tedium vitae, que eles nunca puderam conhecer, ao menos em toda a sua implacável e vasta realidade, porque é preciso haver calcado, como eu, todas as gerações e todas as ruínas, para experimentar esse profundo fastio da existência. Prometeu. Milheiros de anos? Ahasverus. Meu nome é Ahasverus: vivia em Jerusalém, ao tempo em que iam crucificar Jesus Cristo. Quando ele passou pela minha porta, afrouxou ao peso do madeiro que levava aos ombros, e eu empurrei-o, bradando-lhe que não parasse, 2  que não descansasse, que fosse andando até à colina, onde tinha de ser crucificado... Então uma voz anunciou-me do céu que eu andaria sempre, continuamente, até o fim dos tempos. Tal é a minha culpa; não tive piedade para com aquele que ia morrer. Não sei mesmo como isto foi. Os fariseus diziam que o filho de Maria vinha destruir a lei, e que era preciso matá-lo; eu, pobre ignorante, quis realçar o meu zelo e daí a ação daquele dia. Que de vezes vi isto mesmo, depois, atravessando os tempos e as cidades! Onde quer que o zelo penetrou numa alma subalterna, fez-se cruel ou ridículo. Foi a minha culpa irremissível. Prometeu. Grave culpa, em verdade, mas a pena foi benévola. Os outros homens leram da vida um capítulo, tu leste o livro inteiro. Que sabe um capítulo de outro capítulo? Nada; mas o que os leu a todos, liga-os e conclui. Há páginas melancólicas? Há outras joviais e felizes. À convulsão trágica precede a do riso, a vida brota da morte, cegonhas e andorinhas trocam de clima, sem jamais abandoná- lo inteiramente; é assim que tudo se concerta e restitui. Tu viste isso, não dez vezes, não mil vezes, mas todas as vezes; viste a magnificência da terra curando a aflição da alma, e a alegria da alma suprindo à desolação das cousas; dança alternada da natureza, que dá a mão esquerda a Jó e a direita a Sardanapalo. Ahasverus. Que sabes tu da minha vida? Nada; ignoras a vida humana. Prometeu. Ignoro a vida humana? Deixa-me rir! Eia, homem perpétuo, explica-te. Conta-me tudo; saíste de Jerusalém... Ahasverus. Saí de Jerusalém. Comecei a peregrinação dos tempos. Ia a toda parte, qualquer que fosse a raça, o culto ou a língua; sóis e neves, povos bárbaros e cultos, ilhas, continentes, onde quer que respirasse um homem aí respirei eu. Nunca mais trabalhei. Trabalho é refúgio, e não tive esse refúgio. Cada manhã achava comigo a moeda do dia... Vede; cá está a última. Ide, que já não sois precisa (atira a moeda ao longe). Não trabalhava, andava apenas, sempre, sempre, sempre, um dia e outro dia, um ano e outro ano, e todos os anos, e todos os séculos. A eterna justiça soube o que fez: somou a eternidade com a ociosidade. As gerações legavam-me umas às outras. As línguas que morriam ficavam com o meu nome embutido na ossada. Com o volver dos tempos, esquecia-se tudo; os heróis dissipavam-se em mitos, na penumbra, ao longe; e a história ia caindo aos pedaços, não lhe ficando mais que duas ou três feições vagas e remotas. E eu via-as de um modo e de outro modo. Falaste em capítulo? Os que se foram, à nascença dos impérios, levaram a impressão da perpetuidade deles; os que expiraram quando eles decaíam, enterraram-se com a esperança da recomposição; mas sabes tu o que é ver as mesmas cousas, sem parar, a mesma alternativa de prosperidade e desolação, desolação e prosperidade, eternas exéquias e eternas aleluias, auroras sobre auroras, ocasos sobre ocasos? Prometeu. Mas não padeceste, creio; é alguma cousa não padecer nada. Ahasverus. Sim, mas vi padecer os outros homens, e para o fim o espetáculo da alegria dava-me a mesma sensação que os discursos de um doido. Fatalidades do sangue e da carne, conflitos sem fim, tudo vi passar a meus olhos, a ponto que a noite me fez perder o gosto ao dia, e acabo não distinguindo as flores das urzes. Tudo se me confunde na retina enfarada. Prometeu. Pessoalmente não te doeu nada; e eu que padeci por tempos inúmeros o efeito da cólera divina? Ahasverus. Tu? Prometeu. Prometeu é o meu nome. Ahasverus. Tu Prometeu? 3  Prometeu. E qual foi o meu crime? Fiz de lodo e água os primeiros homens, e depois, compadecido, roubei para eles o fogo do céu. Tal foi o meu crime. Júpiter, que então regia o Olimpo, condenou-me ao mais cruel suplício. Anda, sobe comigo a este rochedo. Ahasverus. Contas-me uma fábula. Conheço esse sonho helênico. Prometeu. Velho incrédulo! Anda ver as próprias correntes que me agrilhoaram; foi uma pena excessiva para nenhuma culpa; mas a divindade orgulhosa e terrível... Chegamos, olha, aqui estão elas... Ahasverus. O tempo que tudo rói não as quis então? Prometeu. Eram de mão divina; fabricou-as Vulcano. Dois emissários do céu vieram atar-me ao rochedo, e uma águia, como aquela que lá corta o horizonte, comia-me o fígado, sem consumi-lo nunca. Durou isto tempos que não contei. Não, não podes imaginar este suplício... Ahasverus. Não me iludes? Tu Prometeu? Não foi então um sonho da imaginação antiga? Prometeu. Olha bem para mim, palpa estas mãos. Vê se existo. Ahasverus. Moisés mentiu-me. Tu Prometeu, criador dos primeiros homens? Prometeu. Foi o meu crime. Ahasverus. Sim, foi o teu crime, artífice do inferno; foi o teu crime inexplicável. Aqui devias ter ficado por todos os tempos, agrilhoado e devorado, tu, origem dos males que me afligiram. Careci de piedade, é certo; mas tu, que me trouxeste à existência, divindade perversa, foste a causa original de tudo. Prometeu. A morte próxima obscurece-te a razão. Ahasverus. Sim, és tu mesmo, tens a fronte olímpica, forte e belo titã: és tu mesmo... São estas as cadeias? Não vejo o sinal das tuas lágrimas. Prometeu. Chorei-as pela tua raça. Ahasverus. Ela chorou muito mais por tua culpa. Prometeu. Ouve, último homem, último ingrato! Ahasverus. Para que quero eu palavras tuas? Quero os teus gemidos, divindade perversa. Aqui estão as cadeias. Vê como as levanto nas mãos; ouve o tinir dos ferros... Quem te desagrilhoou outrora? Prometeu.  Hércules. Ahasverus. Hércules... Vê se ele te presta igual serviço, agora que vais ser novamente agrilhoado. Prometeu.  Deliras. Ahasverus. O céu deu-te o primeiro castigo; agora a terra vai dar-te o segundo e derradeiro. Nem Hércules poderá mais romper estes ferros. Olha como os agito no ar, à maneira de plumas; é que eu represento a força dos desesperos milenários. Toda a humanidade está em mim. Antes de cair no abismo, escreverei nesta pedra o epitáfio de um mundo. Chamarei a águia, e ela virá; dir-lhe-ei que o derradeiro homem, ao partir da vida, deixa-lhe um regalo de deuses. Prometeu. Pobre ignorante, que rejeitas um trono! Não, não podes mesmo rejeitá-lo. Ahasverus. És tu agora que deliras. Eia, prostra-te, deixa-me ligar-te os braços. Assim, bem, não resistirás mais; arqueja para aí. Agora as pernas... Prometeu. Acaba, acaba. São as paixões da terra que se voltam contra mim; mas eu, que não sou homem, não conheço a ingratidão. Não arrancarás uma letra ao teu destino, ele se cumprirá inteiro. Tu mesmo serás o novo Hércules. Eu, que anunciei a glória do outro, anuncio a tua; e não serás menos generoso que ele. Ahasverus. Deliras tu? 4  Prometeu. A verdade ignota aos homens é o delírio de quem a anuncia. Anda, acaba. Ahasverus. A glória não paga nada, e extingue-se. Prometeu. Esta não se extinguirá. Acaba, acaba; ensina ao bico adunco da águia como me há de devorar a entranha; mas escuta... Não, não escutes nada; não podes entender-me. Ahasverus. Fala, fala. Prometeu. O mundo passageiro não pode entender o mundo eterno; mas tu serás o elo entre ambos. Ahasverus. Dize tudo. Prometeu. Não digo nada; anda, aperta bem estes pulsos, para que eu não fuja, para que me aches aqui à tua volta. Que te diga tudo? Já te disse que uma raça nova povoará a terra, feita dos melhores espíritos da raça extinta; a multidão dos outros perecerá. Nobre família, lúcida e poderosa, será perfeita comunhão do divino com o humano. Outros serão os tempos, mas entre eles e estes um elo é preciso, e esse elo és tu. Ahasverus. Eu? Prometeu. Tu mesmo, tu eleito, tu, rei. Sim, Ahasverus, tu serás rei.",
        "gender": "male",
        "pch_occurrences": {
            "testa": {
                "syns": [
                    "fronte",
                    "testas",
                    "frontes"
                ],
                "occurrences": [
                    "fronte"
                ],
                "occurrences_n": 1
            },
            "olho": {
                "syns": [
                    "olhos"
                ],
                "occurrences": [
                    "olhos",
                    "olhos",
                    "olho",
                    "olho"
                ],
                "occurrences_n": 4
            },
            "ombro": {
                "syns": [
                    "ombros"
                ],
                "occurrences": [
                    "ombros",
                    "ombro"
                ],
                "occurrences_n": 2
            },
            "braço": {
                "syns": [
                    "braços"
                ],
                "occurrences": [
                    "braço",
                    "braços"
                ],
                "occurrences_n": 2
            },
            "pulso": {
                "syns": [
                    "pulsos"
                ],
                "occurrences": [
                    "pulso",
                    "pulsos"
                ],
                "occurrences_n": 2
            },
            "mão": {
                "syns": [
                    "mãos"
                ],
                "occurrences": [
                    "mão",
                    "mão",
                    "mão",
                    "mão",
                    "mãos",
                    "mãos"
                ],
                "occurrences_n": 6
            },
            "perna": {
                "syns": [
                    "pernas"
                ],
                "occurrences": [
                    "pernas",
                    "perna"
                ],
                "occurrences_n": 2
            },
            "osso": {
                "syns": [
                    "ossos"
                ],
                "occurrences": [
                    "osso",
                    "ossos"
                ],
                "occurrences_n": 2
            },
            "língua": {
                "syns": [
                    "línguas"
                ],
                "occurrences": [
                    "línguas",
                    "língua",
                    "língua"
                ],
                "occurrences_n": 3
            }
        },
        "dependencies": [
            {
                "head": "Meu nome",
                "child": "Ahasverus",
                "dep_h": "nsubj",
                "pos_h": "NOUN",
                "lemma_h": "nome",
                "dep_c": "ROOT",
                "pos_c": "PROPN",
                "lemma_c": "Ahasverus",
                "categories": [],
                "pch_dependencies": []
            },
            {
                "head": "Ahasverus",
                "child": "Meu nome",
                "dep_h": "ROOT",
                "pos_h": "PROPN",
                "lemma_h": "Ahasverus",
                "dep_c": "nsubj",
                "pos_c": "NOUN",
                "lemma_c": "nome",
                "categories": [],
                "pch_dependencies": []
            },
            {
                "head": "Jerusalém",
                "child": "Ahasverus",
                "dep_h": "obl",
                "pos_h": "PROPN",
                "lemma_h": "Jerusalém",
                "dep_c": "ROOT",
                "pos_c": "PROPN",
                "lemma_c": "Ahasverus",
                "categories": [],
                "pch_dependencies": []
            },
            {
                "head": "tempo",
                "child": "Ahasverus",
                "dep_h": "obl",
                "pos_h": "NOUN",
                "lemma_h": "tempo",
                "dep_c": "ROOT",
                "pos_c": "PROPN",
                "lemma_c": "Ahasverus",
                "categories": [],
                "pch_dependencies": []
            },
            {
                "head": "Jesus Cristo",
                "child": "Ahasverus",
                "dep_h": "obj",
                "pos_h": "PROPN",
                "lemma_h": "Jesus",
                "dep_c": "ROOT",
                "pos_c": "PROPN",
                "lemma_c": "Ahasverus",
                "categories": [],
                "pch_dependencies": []
            }
        ]
    },
    {
        "class": "PESSOA",
        "entity": "O errante",
        "sentence": "O errante pousará.",
        "start_char": 10724,
        "end_char": 10733,
        "excerpt": "Tu mesmo, tu eleito, tu, rei. Sim, Ahasverus, tu serás rei. O errante pousará.",
        "gender": "male",
        "pch_occurrences": null,
        "dependencies": [
            {
                "head": "pousará",
                "child": "O errante",
                "dep_h": "ROOT",
                "pos_h": "VERB",
                "lemma_h": "pousar",
                "dep_c": "nsubj",
                "pos_c": "NOUN",
                "lemma_c": "errante",
                "categories": [
                    "social"
                ],
                "pch_dependencies": []
            }
        ]
    },
    {
        "class": "PESSOA",
        "entity": "os homens",
        "sentence": "O desprezado dos homens governará os homens.",
        "start_char": 10757,
        "end_char": 10766,
        "excerpt": "Sim, Ahasverus, tu serás rei. O errante pousará. O desprezado dos homens governará os homens.",
        "gender": "male",
        "pch_occurrences": null,
        "dependencies": [
            {
                "head": "governará",
                "child": "os homens",
                "dep_h": "ROOT",
                "pos_h": "VERB",
                "lemma_h": "governar",
                "dep_c": "obj",
                "pos_c": "NOUN",
                "lemma_c": "homem",
                "categories": [
                    "outro"
                ],
                "pch_dependencies": []
            }
        ]
    },
    {
        "class": "PESSOA",
        "entity": "asverus",
        "sentence": "Ahasverus.",
        "start_char": 396,
        "end_char": 403,
        "excerpt": "Medita, depois sonha. Vai declinando o dia. Ahasverus.",
        "gender": "male",
        "pch_occurrences": null,
        "dependencies": []
    },
    {
        "class": "PESSOA",
        "entity": "Titão",
        "sentence": "Titão artificioso, iludes-me...",
        "start_char": 10799,
        "end_char": 10804,
        "excerpt": "O desprezado dos homens governará os homens. Ahasverus. Titão artificioso, iludes-me...",
        "gender": "male",
        "pch_occurrences": null,
        "dependencies": []
    },
    {
        "class": "PESSOA",
        "entity": "Rei",
        "sentence": "Rei, eu?",
        "start_char": 10831,
        "end_char": 10834,
        "excerpt": "Rei, eu? Prometeu. Tu rei.",
        "gender": "male",
        "pch_occurrences": null,
        "dependencies": []
    },
    {
        "class": "PESSOA",
        "entity": "Tu rei",
        "sentence": "Tu rei.",
        "start_char": 10850,
        "end_char": 10856,
        "excerpt": "Rei, eu? Prometeu. Tu rei.",
        "gender": "unknown",
        "pch_occurrences": null,
        "dependencies": []
    },
    {
        "class": "PESSOA",
        "entity": "mundo velho",
        "sentence": "O mundo novo precisa de uma tradição do mundo velho, e ninguém pode falar de um a outro como tu.",
        "start_char": 10915,
        "end_char": 10926,
        "excerpt": "Tu rei. Que outro seria? O mundo novo precisa de uma tradição do mundo velho, e ninguém pode falar de um a outro como tu.",
        "gender": "unknown",
        "pch_occurrences": null,
        "dependencies": []
    },
    {
        "class": "PESSOA",
        "entity": "novos homens",
        "sentence": "Contarás aos novos homens todo o bem e todo o mal antigo.",
        "start_char": 11117,
        "end_char": 11129,
        "excerpt": "Assim não haverá interrupção entre as duas humanidades. O perfeito procederá do imperfeito, e a tua boca dir-lhe-á as suas origens. Contarás aos novos homens todo o bem e todo o mal antigo.",
        "gender": "unknown",
        "pch_occurrences": {
            "boca": {
                "syns": [
                    "bocas",
                    "lábio",
                    "lábios"
                ],
                "occurrences": [
                    "boca"
                ],
                "occurrences_n": 1
            }
        },
        "dependencies": []
    },
    {
        "class": "PESSOA",
        "entity": "asverus",
        "sentence": "Ahasverus.",
        "start_char": 396,
        "end_char": 403,
        "excerpt": "Medita, depois sonha. Vai declinando o dia. Ahasverus.",
        "gender": "male",
        "pch_occurrences": null,
        "dependencies": []
    },
    {
        "class": "PESSOA",
        "entity": "asverus",
        "sentence": "Ahasverus.",
        "start_char": 396,
        "end_char": 403,
        "excerpt": "Medita, depois sonha. Vai declinando o dia. Ahasverus.",
        "gender": "male",
        "pch_occurrences": null,
        "dependencies": []
    },
    {
        "class": "PESSOA",
        "entity": "Titão",
        "sentence": "Titão, é justo.",
        "start_char": 11419,
        "end_char": 11424,
        "excerpt": "vida nova e melhor... Visão excelsa! Titão, é justo.",
        "gender": "male",
        "pch_occurrences": null,
        "dependencies": []
    },
    {
        "class": "PESSOA",
        "entity": "os espíritos",
        "sentence": "Bem, deixa-me, voltarás um dia, quando este imenso céu for aberto para que desçam os espíritos da vida nova.",
        "start_char": 11667,
        "end_char": 11679,
        "excerpt": "Não, tu mofas de mim. Prometeu. Bem, deixa-me, voltarás um dia, quando este imenso céu for aberto para que desçam os espíritos da vida nova.",
        "gender": "male",
        "pch_occurrences": null,
        "dependencies": [
            {
                "head": "desçam",
                "child": "os espíritos",
                "dep_h": "advcl",
                "pos_h": "VERB",
                "lemma_h": "desçar",
                "dep_c": "obj",
                "pos_c": "NOUN",
                "lemma_c": "espírito",
                "categories": [],
                "pch_dependencies": []
            },
            {
                "head": "os espíritos",
                "child": "vida",
                "dep_h": "obj",
                "pos_h": "NOUN",
                "lemma_h": "espírito",
                "dep_c": "nmod",
                "pos_c": "NOUN",
                "lemma_c": "vida",
                "categories": [],
                "pch_dependencies": []
            },
            {
                "head": "vida",
                "child": "os espíritos",
                "dep_h": "nmod",
                "pos_h": "NOUN",
                "lemma_h": "vida",
                "dep_c": "obj",
                "pos_c": "NOUN",
                "lemma_c": "espírito",
                "categories": [],
                "pch_dependencies": []
            }
        ]
    },
    {
        "class": "PESSOA",
        "entity": "asverus",
        "sentence": "Ahasverus.",
        "start_char": 396,
        "end_char": 403,
        "excerpt": "Medita, depois sonha. Vai declinando o dia. Ahasverus.",
        "gender": "male",
        "pch_occurrences": null,
        "dependencies": []
    },
    {
        "class": "PESSOA",
        "entity": "asverus",
        "sentence": "Ahasverus.",
        "start_char": 396,
        "end_char": 403,
        "excerpt": "Medita, depois sonha. Vai declinando o dia. Ahasverus.",
        "gender": "male",
        "pch_occurrences": null,
        "dependencies": []
    },
    {
        "class": "PESSOA",
        "entity": "asverus",
        "sentence": "Ahasverus.",
        "start_char": 396,
        "end_char": 403,
        "excerpt": "Medita, depois sonha. Vai declinando o dia. Ahasverus.",
        "gender": "male",
        "pch_occurrences": null,
        "dependencies": []
    },
    {
        "class": "PESSOA",
        "entity": "asverus",
        "sentence": "Ahasverus.",
        "start_char": 396,
        "end_char": 403,
        "excerpt": "Medita, depois sonha. Vai declinando o dia. Ahasverus.",
        "gender": "male",
        "pch_occurrences": null,
        "dependencies": []
    },
    {
        "class": "PESSOA",
        "entity": "Abraão",
        "sentence": "O seio de Abraão das tuas velhas Escrituras não é senão esse mundo ulterior e perfeito.",
        "start_char": 12336,
        "end_char": 12342,
        "excerpt": "A descrição da vida não vale a sensação da vida; tê-la-ás prodigiosa. O seio de Abraão das tuas velhas Escrituras não é senão esse mundo ulterior e perfeito. Lá verás David e os profetas.",
        "gender": "male",
        "pch_occurrences": {
            "peito": {
                "syns": [
                    "peitos",
                    "colo",
                    "colos",
                    "busto",
                    "bustos",
                    "seio",
                    "seios",
                    "torso",
                    "torsos",
                    "tórax",
                    "tóraxes"
                ],
                "occurrences": [
                    "seio"
                ],
                "occurrences_n": 1
            }
        },
        "dependencies": [
            {
                "head": "O seio",
                "child": "Abraão",
                "dep_h": "ROOT",
                "pos_h": "NOUN",
                "lemma_h": "seio",
                "dep_c": "nmod",
                "pos_c": "PROPN",
                "lemma_c": "Abraão",
                "categories": [],
                "pch_dependencies": []
            },
            {
                "head": "Abraão",
                "child": "O seio",
                "dep_h": "nmod",
                "pos_h": "PROPN",
                "lemma_h": "Abraão",
                "dep_c": "ROOT",
                "pos_c": "NOUN",
                "lemma_c": "seio",
                "categories": [],
                "pch_dependencies": []
            }
        ]
    },
    {
        "class": "PESSOA",
        "entity": "David",
        "sentence": "Lá verás David e os profetas.",
        "start_char": 12423,
        "end_char": 12428,
        "excerpt": "A descrição da vida não vale a sensação da vida; tê-la-ás prodigiosa. O seio de Abraão das tuas velhas Escrituras não é senão esse mundo ulterior e perfeito. Lá verás David e os profetas.",
        "gender": "male",
        "pch_occurrences": {
            "peito": {
                "syns": [
                    "peitos",
                    "colo",
                    "colos",
                    "busto",
                    "bustos",
                    "seio",
                    "seios",
                    "torso",
                    "torsos",
                    "tórax",
                    "tóraxes"
                ],
                "occurrences": [
                    "seio"
                ],
                "occurrences_n": 1
            }
        },
        "dependencies": [
            {
                "head": "verás",
                "child": "David",
                "dep_h": "ROOT",
                "pos_h": "VERB",
                "lemma_h": "verás",
                "dep_c": "nsubj",
                "pos_c": "PROPN",
                "lemma_c": "David",
                "categories": [],
                "pch_dependencies": []
            }
        ]
    },
    {
        "class": "PESSOA",
        "entity": "os profetas",
        "sentence": "Lá verás David e os profetas.",
        "start_char": 12431,
        "end_char": 12442,
        "excerpt": "A descrição da vida não vale a sensação da vida; tê-la-ás prodigiosa. O seio de Abraão das tuas velhas Escrituras não é senão esse mundo ulterior e perfeito. Lá verás David e os profetas.",
        "gender": "male",
        "pch_occurrences": {
            "peito": {
                "syns": [
                    "peitos",
                    "colo",
                    "colos",
                    "busto",
                    "bustos",
                    "seio",
                    "seios",
                    "torso",
                    "torsos",
                    "tórax",
                    "tóraxes"
                ],
                "occurrences": [
                    "seio"
                ],
                "occurrences_n": 1
            }
        },
        "dependencies": [
            {
                "head": "verás",
                "child": "os profetas",
                "dep_h": "ROOT",
                "pos_h": "VERB",
                "lemma_h": "verás",
                "dep_c": "conj",
                "pos_c": "NOUN",
                "lemma_c": "profeta",
                "categories": [
                    "social"
                ],
                "pch_dependencies": []
            }
        ]
    },
    {
        "class": "PESSOA",
        "entity": "asverus",
        "sentence": "Ahasverus.",
        "start_char": 396,
        "end_char": 403,
        "excerpt": "Medita, depois sonha. Vai declinando o dia. Ahasverus.",
        "gender": "male",
        "pch_occurrences": null,
        "dependencies": []
    },
    {
        "class": "PESSOA",
        "entity": "asverus",
        "sentence": "Ahasverus.",
        "start_char": 396,
        "end_char": 403,
        "excerpt": "Medita, depois sonha. Vai declinando o dia. Ahasverus.",
        "gender": "male",
        "pch_occurrences": null,
        "dependencies": []
    },
    {
        "class": "PESSOA",
        "entity": "asverus",
        "sentence": "Ahasverus.",
        "start_char": 396,
        "end_char": 403,
        "excerpt": "Medita, depois sonha. Vai declinando o dia. Ahasverus.",
        "gender": "male",
        "pch_occurrences": null,
        "dependencies": []
    },
    {
        "class": "PESSOA",
        "entity": "Hércules",
        "sentence": "Desata-as, Hércules novo, homem derradeiro de um mundo, que vás ser o primeiro de outro.",
        "start_char": 13151,
        "end_char": 13159,
        "excerpt": "Deixa-me desatar-te estas cadeias... Prometeu. Desata-as, Hércules novo, homem derradeiro de um mundo, que vás ser o primeiro de outro.",
        "gender": "male",
        "pch_occurrences": null,
        "dependencies": [
            {
                "head": "Hércules",
                "child": "novo",
                "dep_h": "parataxis",
                "pos_h": "PROPN",
                "lemma_h": "Hércules",
                "dep_c": "flat:name",
                "pos_c": "ADJ",
                "lemma_c": "novo",
                "categories": [
                    "aparencia"
                ],
                "pch_dependencies": []
            }
        ]
    },
    {
        "class": "PESSOA",
        "entity": "Moisés",
        "sentence": "És mais ainda que o teu Moisés.",
        "start_char": 13309,
        "end_char": 13315,
        "excerpt": "Desata-as, Hércules novo, homem derradeiro de um mundo, que vás ser o primeiro de outro. É o teu destino; nem tu nem eu, ninguém poderá mudá-lo. És mais ainda que o teu Moisés.",
        "gender": "male",
        "pch_occurrences": null,
        "dependencies": [
            {
                "head": "És",
                "child": "o teu Moisés",
                "dep_h": "ROOT",
                "pos_h": "VERB",
                "lemma_h": "És",
                "dep_c": "nsubj",
                "pos_c": "PROPN",
                "lemma_c": "Moisés",
                "categories": [],
                "pch_dependencies": []
            }
        ]
    },
    {
        "class": "PESSOA",
        "entity": "o Senhor",
        "sentence": "Do alto do Nebo, viu ele, prestes a morrer, toda a terra de Jericó, que ia pertencer à sua posteridade; e o Senhor lhe disse: \"",
        "start_char": 13423,
        "end_char": 13431,
        "excerpt": "É o teu destino; nem tu nem eu, ninguém poderá mudá-lo. És mais ainda que o teu Moisés. Do alto do Nebo, viu ele, prestes a morrer, toda a terra de Jericó, que ia pertencer à sua posteridade; e o Senhor lhe disse: \"",
        "gender": "male",
        "pch_occurrences": null,
        "dependencies": [
            {
                "head": "disse",
                "child": "o Senhor",
                "dep_h": "conj",
                "pos_h": "VERB",
                "lemma_h": "dizer",
                "dep_c": "nsubj",
                "pos_c": "PROPN",
                "lemma_c": "Senhor",
                "categories": [],
                "pch_dependencies": []
            }
        ]
    },
    {
        "class": "PESSOA",
        "entity": "Ahasverus",
        "sentence": "Tu passarás a ela, Ahasverus; tu habitarás",
        "start_char": 13515,
        "end_char": 13524,
        "excerpt": "Tu a viste com teus olhos, e não passarás a ela. \" Tu passarás a ela, Ahasverus; tu habitarás",
        "gender": "male",
        "pch_occurrences": {
            "olho": {
                "syns": [
                    "olhos"
                ],
                "occurrences": [
                    "olhos",
                    "olho"
                ],
                "occurrences_n": 2
            }
        },
        "dependencies": []
    },
    {
        "class": "PESSOA",
        "entity": "asverus",
        "sentence": "Ahasverus.",
        "start_char": 396,
        "end_char": 403,
        "excerpt": "Medita, depois sonha. Vai declinando o dia. Ahasverus.",
        "gender": "male",
        "pch_occurrences": null,
        "dependencies": []
    },
    {
        "class": "PESSOA",
        "entity": "Rei",
        "sentence": "Rei disseste?Prometeu.",
        "start_char": 13702,
        "end_char": 13705,
        "excerpt": "Põe a mão sobre a minha cabeça, olha bem para mim; incute-me a tua realidade e a tua predição; deixa-me sentir um pouco da vida nova e plena... Rei disseste?Prometeu.",
        "gender": "male",
        "pch_occurrences": {
            "cabeça": {
                "syns": [
                    "cabeças",
                    "crânio",
                    "crânios",
                    "moleira",
                    "moleiras",
                    "cocuruto",
                    "cocurutos"
                ],
                "occurrences": [
                    "cabeça"
                ],
                "occurrences_n": 1
            },
            "mão": {
                "syns": [
                    "mãos"
                ],
                "occurrences": [
                    "mão"
                ],
                "occurrences_n": 1
            }
        },
        "dependencies": [
            {
                "head": "Rei",
                "child": "disseste?Prometeu",
                "dep_h": "nsubj",
                "pos_h": "PROPN",
                "lemma_h": "Rei",
                "dep_c": "ROOT",
                "pos_c": "PROPN",
                "lemma_c": "disseste?Prometeu",
                "categories": [],
                "pch_dependencies": []
            },
            {
                "head": "disseste?Prometeu",
                "child": "Rei",
                "dep_h": "ROOT",
                "pos_h": "PROPN",
                "lemma_h": "disseste?Prometeu",
                "dep_c": "nsubj",
                "pos_c": "PROPN",
                "lemma_c": "Rei",
                "categories": [],
                "pch_dependencies": []
            }
        ]
    },
    {
        "class": "PESSOA",
        "entity": "Prometeu",
        "sentence": "Rei disseste?Prometeu.",
        "start_char": 13715,
        "end_char": 13723,
        "excerpt": "Põe a mão sobre a minha cabeça, olha bem para mim; incute-me a tua realidade e a tua predição; deixa-me sentir um pouco da vida nova e plena... Rei disseste?Prometeu.",
        "gender": "male",
        "pch_occurrences": {
            "cabeça": {
                "syns": [
                    "cabeças",
                    "crânio",
                    "crânios",
                    "moleira",
                    "moleiras",
                    "cocuruto",
                    "cocurutos"
                ],
                "occurrences": [
                    "cabeça"
                ],
                "occurrences_n": 1
            },
            "mão": {
                "syns": [
                    "mãos"
                ],
                "occurrences": [
                    "mão"
                ],
                "occurrences_n": 1
            }
        },
        "dependencies": [
            {
                "head": "Rei",
                "child": "disseste?Prometeu",
                "dep_h": "nsubj",
                "pos_h": "PROPN",
                "lemma_h": "Rei",
                "dep_c": "ROOT",
                "pos_c": "PROPN",
                "lemma_c": "disseste?Prometeu",
                "categories": [],
                "pch_dependencies": []
            },
            {
                "head": "disseste?Prometeu",
                "child": "Rei",
                "dep_h": "ROOT",
                "pos_h": "PROPN",
                "lemma_h": "disseste?Prometeu",
                "dep_c": "nsubj",
                "pos_c": "PROPN",
                "lemma_c": "Rei",
                "categories": [],
                "pch_dependencies": []
            }
        ]
    },
    {
        "class": "PESSOA",
        "entity": "Rei eleito",
        "sentence": "Rei eleito de uma raça eleita.",
        "start_char": 13725,
        "end_char": 13735,
        "excerpt": "incute-me a tua realidade e a tua predição; deixa-me sentir um pouco da vida nova e plena... Rei disseste?Prometeu. Rei eleito de uma raça eleita.",
        "gender": "male",
        "pch_occurrences": null,
        "dependencies": []
    },
    {
        "class": "PESSOA",
        "entity": "asverus",
        "sentence": "Ahasverus.",
        "start_char": 396,
        "end_char": 403,
        "excerpt": "Medita, depois sonha. Vai declinando o dia. Ahasverus.",
        "gender": "male",
        "pch_occurrences": null,
        "dependencies": []
    },
    {
        "class": "PESSOA",
        "entity": "As duas águias",
        "sentence": "As duas águias aproximam-se.)",
        "start_char": 13935,
        "end_char": 13949,
        "excerpt": "Onde uma vida cuspiu lama, outra vida porá uma auréola. Anda, fala mais... fala mais... (Continua sonhando. As duas águias aproximam-se.)",
        "gender": "female",
        "pch_occurrences": null,
        "dependencies": [
            {
                "head": "aproximam-se",
                "child": "As duas águias",
                "dep_h": "ROOT",
                "pos_h": "VERB",
                "lemma_h": "aproximam-se",
                "dep_c": "nsubj",
                "pos_c": "NOUN",
                "lemma_c": "águia",
                "categories": [],
                "pch_dependencies": []
            }
        ]
    },
    {
        "class": "PESSOA",
        "entity": "último homem",
        "sentence": "Ai, ai, ai deste último homem, está morrendo e ainda sonha com a vida.",
        "start_char": 13993,
        "end_char": 14005,
        "excerpt": "As duas águias aproximam-se.) Uma águia. Ai, ai, ai deste último homem, está morrendo e ainda sonha com a vida.",
        "gender": "male",
        "pch_occurrences": null,
        "dependencies": []
    }
]